title,desc,tags
杭州不止西湖！这些老街古巷藏着人间烟火,如果仅将西湖或网红视为杭州的全部，那对这座城市的理解就有些片面了。实际上，杭州有很多值得一去的老街古巷，藏着浓重的市井烟火气。 	 [一R]南宋御街｜商业中心（上城区） 南宋都城临安的中轴线，也是当时的商业中心。如今，御街也依然延续着这种商业繁荣，集聚了各种美食和手工艺品。整体建筑风格上，新旧融合，青砖黑瓦、飞檐翘角，充满江南水乡气息。 	 [二R]河坊街｜旅游步行街（上城区） 吴山脚下，南宋的文化中心和经贸中心。如今，是集旅游、商业等功能为一体的历史步行街区，有各种各样的手工艺品店和美食小吃。 	 [三R]五柳巷｜江南水乡里弄（上城区） 五柳巷保留了民国时期的里弄建筑，并且东依东河，至今保留了老杭州人滨水而居的生活方式。 	 [四R]大马弄｜马路菜市场（上城区） 最具烟火气息的地方，230米的小弄里聚集了各种各样的商铺，干货卤味、葱包烩、炸鱼等等。“杭州最后的马路菜市场”，嘈杂但有原汁原味的生活气息。 	 [五R]思鑫坊｜石库门建筑群（上城区） 地处湖滨商圈中心，承载了杭州半部民国史，杭州最早的石库门建筑群，保留“清水砖墙、雕花门楣”的典型风格。 	 [六R]小营巷｜红色记忆（上城区） 清末民初时期的杭州民居。“江南红巷”，承载了波澜壮阔的红色历史，也是钱学森故居所在地。 	 [七R]小河直街｜水乡风情（拱墅区） 位于京杭大运河、小河、余杭塘河的三河交汇处，保留了古朴的民宅和作坊。街区两侧小楼枕水而居，白墙黑瓦、小桥流水，充满江南水乡特色。 	 [八R]桥西直街｜特色博物馆众多（拱墅区） 京杭运河边，见证了运河沿岸的繁华风光，也浓缩了明清工业发展的历史。中国伞博物馆、扇博物馆、刀剪剑博物馆都在这里。 	 [九R]大兜路街区｜禅意市集（拱墅区） 运河第一街，以香积寺为中心，形成了以佛文化交流为特色的禅意氛围。 	 [加一R]西兴古镇｜大隐于市（滨江区） 所有巷子里游客最少的一条了。浙东古运河起点，完整保留清末民初“两街一河”格局，没有什么商业气息，保留了真实的历史痕迹，原住居民很多，家家都有河埠头。 	 #城市中的烟火气[话题]# #拍拍身边烟火气[话题]# #城市里的老街[话题]# #爱上了这里的生活气息[话题]# #扫街[话题]# #杭州老街[话题]# #杭州小巷[话题]# #杭州古街[话题]# #杭州周末去哪儿[话题]# #杭州旅游[话题]#,"城市中的烟火气, 拍拍身边烟火气, 城市里的老街, 爱上了这里的生活气息, 扫街, 杭州老街, 杭州小巷, 杭州古街, 杭州周末去哪儿, 杭州旅游"
12.6实拍，给12月去杭州的家人们😭,哭死，看了网上那么多攻略，怎么就没一个人告诉我淡季的杭州西湖也有这么多人呀👭 杭州真的很好玩，但是就比较容易踩坑，所以第一次去杭州一定要做好攻略！ 我把西湖的旅游路线整理出来了，大家码住呀❤️ . 找机位&学摄影🔍蚂蚁摄影.🅰.🅿.🅿 🈶️300➕景点旅游拍照攻略📖 🈶免💴摄影教程 . ✅西湖路线： 码头➡️三潭印月➡️花港观鱼➡️太子湾公园➡️净慈寺➡️雷峰塔➡️苏堤春晓➡️曲院风荷➡️西泠印社➡️平湖秋月➡️断桥➡️武林夜市 . ✅citywalk路线： 五柳巷➡️鼓楼➡️十五奎巷➡️大马弄➡️小河直街（体验杭州最原始的街道，有一些文艺感十足的小店，穿着新中式拍照很搭） . ✅三日游路线： 西湖➡️断桥残雪➡️曲苑风荷➡️苏堤➡️花港观鱼➡️雷峰塔 法喜寺➡️灵隐寺➡️杭州博物馆➡️河坊街➡️南宋御街 西溪湿地➡️杭州植物园➡️小河直街➡️拱宸桥➡️武林夜市 . 🎈备注： 灵隐寺进去后会免费发香，不需要提前购买⛩ 出门前要查看天气和温度，选择合适的衣物，早晚还是很凉的🧥 景区内不建议自己开车🚙，非常堵并且也没地方停车 西湖很大很大，一定要提前做好攻略规划好路线再行动，穿舒适的鞋子👟，不然会很累 像俯瞰西湖可以去北高峰，宝石山🌓 不爱吃酸甜口味的千万不要尝试西湖醋鱼🐟 想去博物馆需要提前预约，周一闭馆不要跑空 🍭可以尝一尝东坡肉、龙井虾仁、衢州菜、葱包烩、叫花童鸡，糟烩鞭笋 . #冬日旅行收藏夹[话题]##藏在小城里的冬天[话题]##镜头里的城市C机位[话题]# #小红书影像大赛[话题]# #在路上也在街上[话题]# #有国风小城[话题]# #蚂蚁摄影app[话题]# #杭州必去景点[话题]# #旅游[话题]# #旅游攻略[话题]# #旅行[话题]# #来拍照了[话题]# #拍照打卡[话题]# #杭州[话题]# #杭州旅游[话题]# #杭州拍照[话题]# #杭州自由行[话题]# #杭州拍照打卡[话题]# #杭州西湖旅游[话题]# #西湖[话题]# #西湖美景[话题]# #西湖十景[话题]# #杭州拍照圣地[话题]# #夜游西湖[话题]# #西湖夜景[话题]# #杭州夜景[话题]##旅行随手拍[话题]# #旅行随地大小拍[话题]# @户外薯 @生活薯 @摄影薯 #被低估的宝藏小城[话题]#,"冬日旅行收藏夹, 藏在小城里的冬天, 镜头里的城市C机位, 小红书影像大赛, 在路上也在街上, 有国风小城, 蚂蚁摄影app, 杭州必去景点, 旅游, 旅游攻略, 旅行, 来拍照了, 拍照打卡, 杭州, 杭州旅游, 杭州拍照, 杭州自由行, 杭州拍照打卡, 杭州西湖旅游, 西湖, 西湖美景, 西湖十景, 杭州拍照圣地, 夜游西湖, 西湖夜景, 杭州夜景, 旅行随手拍, 旅行随地大小拍, 被低估的宝藏小城"
去过N次杭州后不去挤景点，带娃轻松日行1w步,📍去熟悉的城市走走不一样的路线，这一次不想迁就小朋友去博物馆动物园的，走走大人小孩都能逛的路线😆… 	 Day1 孩儿巷-中山北路-西湖边-滨江商圈（银泰in77) Day2 小河直街-拱宸桥（桥西历史街区） — ❤️孩儿巷到中山北路的小店挺多的，但是不算特别密集，走走逛逛歇歇完全不觉得累的，比较推荐的小店🈶： ☕️Pasto coficofi 秃头小狗 ☕️parking coffee 🍞慢熟面包 💌猫森商店 💌橡皮文具店 🥯红跑车烘焙 🍡阿嬷的糖水铺 ☕️村口大树 ☕️吉市cafe 🍔black burger 🥯cycle cycle 🍜小狗面馆 👉陆游纪念馆 … 这边逛完可以直接走到西湖边去，走走也近的，然后就沿着西湖边随意发挥吧，想逛小摊的话可以往商圈方向走，沿路有市集。 · 第二天想到武林门码头⛵️坐1号线水上巴士到小河直街，结果碰到船停运了🤣，那只能打车走了。小河直街真心说不咋样🙅‍♀️，但是没来过的话走一圈还行，这里主要适合古装拍照，其他风景啊小店啊都太一般了，在江南一带只能算是中下水平[偷笑R]。相比而言桥西历史街区这边的商业更好，而且这里还有伞博物馆、刀剑博物馆… . 🍽️推荐餐厅: 根据本次活动范围找了几家拱墅区美食，来自我爸老郑的推荐菜单[喝奶茶R]： 1️⃣23号墙门菜（抱腌菜鲈鱼🐟、蒸臭豆腐都是好吃的，总体菜品不错还实惠，老板服务态度很好，就是有些咸，下单时候要跟备注少加盐😬） 2️⃣民厨饭堂私房菜（这次没有吃） 3️⃣毛毛面馆（据说炒菜比面好吃） 4️⃣老头油爆虾（老牌连锁店，偏甜口，味道可以的，就是东坡肉别点了，离东坡肉的标准还有距离） . 🏠住宿 我们这次住在【武林广场延安路亚朵X酒店】，地理位置不错，到西湖啊citywalk啊基本可以走着去，不过房间比较小，这个商圈这种类型的酒店挺多的，大差不差的。 … #分享我的日常[话题]# #带娃去哪儿玩[话题]# #适合亲子旅游的地方[话题]# #遛娃好去处[话题]# #遛娃日常[话题]# #杭州[话题]#,"分享我的日常, 带娃去哪儿玩, 适合亲子旅游的地方, 遛娃好去处, 遛娃日常, 杭州"
杭州地铁🚇9号线｜沿线出行游玩攻略,#杭州地铁[话题]##杭州地铁9号线[话题]# #杭州轨道交通[话题]##游玩攻略[话题]##杭州citywalk[话题]##地铁[话题]##轨道交通[话题]##杭州[话题]##杭州旅游[话题]##周末去哪儿[话题]# #生活中的小碎片[话题]# #周末去哪儿玩[话题]# #浪漫生活的记录者[话题]##笔记[话题]#灵感#笔记灵感[话题]##杭州旅行攻略[话题]##杭州临平[话题]# #记录我的生活[话题]# #一些片刻[话题]# #去哪儿[话题]# [彩虹R][彩虹R][彩虹R]杭州地铁9号线起于上cheng区观音塘站，连接起上cheng区与临平区，止于临平区龙安站，将连接起上cheng区钱江新城和临平区临平副城的距离连接！ [彩虹R][彩虹R][彩虹R]沿线景点介绍 [星R]观音塘 四季青服装市场 [星R]九睦路 海塘遗址博物馆 [星R]乔司南 丰收湖公园 [星R]临平 临平博物馆/江南水乡文化博物馆 [星R]邱山大街 临平山/临平动物园 🚇杭州地铁9号线开通后，可在御道站换乘杭州地铁19号线，到达杭州西站、杭州萧山国ji机场；在三堡站换乘杭州地铁6号线，到达富阳、滨江、杭州奥体中❤️等区域；在钱江路站换乘杭州地铁2号线、杭州地铁4号线，到达市民中❤️、滨江、城西、城北、萧山等区域；在观音塘站与杭州地铁7号线进行换乘，可到达吴山广场、西湖、萧山等区域，该线路将成为杭州南北方向的一条交通大动mai，市民出行将会方便很多！ ⏰首末班车时间:龙安→观音塘6:02-23:04 观音塘 →龙安 6:10-23:16 [彩虹R][彩虹R][彩虹R][彩虹R]关于换乘 [星R]临平南高铁站:换乘杭海城际铁路 [星R]客运中❤️:换乘1号线/9号线 [星R]御道:5号线/19号线 [星R]三堡:6号线/9号线 [星R]钱江路:换乘2/4/9号线 [星R]观音塘:7/9号线,"杭州地铁, 杭州地铁9号线, 杭州轨道交通, 游玩攻略, 杭州citywalk, 地铁, 轨道交通, 杭州, 杭州旅游, 周末去哪儿, 生活中的小碎片, 周末去哪儿玩, 浪漫生活的记录者, 笔记, 笔记灵感, 杭州旅行攻略, 杭州临平, 记录我的生活, 一些片刻, 去哪儿"
春节来杭州，除了去西湖还要走这条老街路线,春节除了去西湖还要来这里 春节来杭州，除了去西湖一定要走一走这条充满烟火气的老街citywalk路线 	 路线：3元水上巴士7号线-德寿宫-胡雪岩故居-十五奎巷-大马弄-城隍阁-杭州博物馆-河坊街-南宋御街-鼓楼 #反向旅行出门溜溜[话题]# #春节旅游[话题]# #过年出门游玩[话题]# #春节去旅行[话题]# #新春万物皆美好[话题]# #杭州旅游[话题]# #杭州旅游攻略[话题]# #春节去哪儿[话题]# #冬日好去处[话题]# #冬天的西湖也好美[话题]#,"反向旅行出门溜溜, 春节旅游, 过年出门游玩, 春节去旅行, 新春万物皆美好, 杭州旅游, 杭州旅游攻略, 春节去哪儿, 冬日好去处, 冬天的西湖也好美"
杭州📍小河直街Citywalk，全程🈚️回头路,[扶墙R]还是不喜欢走回头路，所以没有回头路 [doge]信誓旦旦要Citywalk，但根本起不来 [害羞R]封面是略改善了一下，觉得像那么回事了 	 👣交通工具：🚇地铁➕🚶步行 ⌚️大概时长：5-6h 	 ⭐️行程改善 1️⃣香积寺（🚇地铁） 	 2️⃣香积寺 🈺营业时间：8:00-17:00，🎫门票：💰20 	 3️⃣大兜路历史街区 	 4️⃣远洋乐堤港 安排好时间，这里🉑吃饭 	 5️⃣小河直街 	 6️⃣小河公园 	 7️⃣桥西历史文化街区 有3个博物馆： 中国杭州工艺美术博物馆 杭州刀剪剑博物馆 中国扇博物馆 	 8️⃣大运河（🚇地铁） 	 🌟个人建议： 1、能早起➕能徒步就看改善版的，吃早午饭的可以参照第二版（是本人） 2、小河直街现在真的太商业化了，喜欢拍照📷可以去打卡，不然还是别去了 3、穿个舒服点的鞋，做好防晒 4、尽量公共交通，打车哪里都堵 	 #小河直街[话题]# #小河公园[话题]# #杭州周末去哪儿[话题]# #徒步路线推荐[话题]# #假日citywalk[话题]# #citywalk[话题]# #人文景点分享[话题]# #杭州旅游[话题]# #杭州徒步[话题]# #香积寺[话题]# #桥西历史街区[话题]# #徒步[话题]# #徒步路线推荐[话题]#,"小河直街, 小河公园, 杭州周末去哪儿, 徒步路线推荐, 假日citywalk, citywalk, 人文景点分享, 杭州旅游, 杭州徒步, 香积寺, 桥西历史街区, 徒步"
🔥🔥杭州十大必去景点！！从这里挑,📍南宋御街 🎫门票：🆓 🚴交通：🚇地铁1号线定安路 ✅推荐理由：沿街有很多特色小店，装修独特，拍照巨出片！古色古香的建筑风格，有梧桐树和古道，咖啡店～ 河坊街 🎫门票：🆓 🚴交通：🚇地铁7号线吴山广场 ✅推荐理由：和南宋御街可以一起逛。河坊街保持了杭州风貌的老街，凝聚了杭州最具代表性的🏠建筑文化、🍵市井文化～ 📍湖滨步行街 🎫门票：🆓 🚴交通：🚇地铁1号线龙翔桥/凤起路 ✅推荐理由：很大的商业综合体。杭州最繁华的商圈，集合了湖滨银泰in77、西湖时代广场多个商业中心～ 📍武林广场 🎫门票：🆓 🚴交通：🚇地铁1号线武林广场/凤起路 ✅推荐理由：推荐晚上去逛武林夜市、一条街吃喝玩乐全部满足！街两边是沿街商铺，有奶茶、小吃 📍西湖风景区（建议抽一天时间） 🎫门票：🆓 🚴交通：🚇地铁1号线龙翔桥 ✅推荐理由：从龙翔桥站出来穿过湖滨银泰就可以到西湖边了。沿湖🛵骑行或散步都很好。景点断桥、北山街、苏堤等 📍灵隐寺/飞来峰 🎫门票：10 🚴交通：🚌公交车7、807或直达线路 ✅推荐理由：灵隐寺在飞来峰景区。来这里祈愿很灵，香火很旺。我和室友来这里许愿过，最后考研考公都上岸了😎 📍城市阳台 🎫门票：🆓 🚴交通：🚇地铁7号线市民中心 ✅推荐理由：除了上海外滩之外的绝美城市天际线，一定要来看看钱塘江边的杭州城市夜景！！每周二、五、六晚7:30和8:30有灯光秀，绝美！！ 📍西溪湿地（建议抽一天时间） 🎫门票：🆓免费收费都有 🚴交通：🚇地铁3号线西溪湿地南站 ✅推荐理由：可以徒步旅行，也可以赏景。周家村、梅竹山庄、西溪梅墅、西溪人家…… 📍小河直街 🎫门票：🆓 🚴交通：🚇地铁10号线北大桥/打车/公交 ✅推荐理由：跟桥西直街、大兜路历史街区一起逛。具有近代江南水乡的特色，粉墙黛瓦。小河直街全天免费开放，是一处可以漫步享受邻里笑语和古朴民宅的惬意地方～ 📍西湖文化广场 🎫门票：🆓 🚴交通：🚇地铁1号线西湖文化广场 ✅推荐理由：夏日清凉好去处。这里有很多博物馆，夏天室内游玩。浙江省自然博物馆、浙江省科技馆、浙江省博物馆。几个博物馆逛下来一天也很充实～  #游玩攻略[话题]#  #杭州[话题]#  #杭州旅游[话题]#  #人文景点分享[话题]#  #城市探寻计划[话题]#  #去哪儿[话题]#  #假日citywalk[话题]#  #城市浪漫地标打卡[话题]#,"游玩攻略, 杭州, 杭州旅游, 人文景点分享, 城市探寻计划, 去哪儿, 假日citywalk, 城市浪漫地标打卡"
在杭州过年去哪玩🧧解锁不一样的年味儿～,"还有不到十天就春节了，上次给大家分享了大运河附近的年味City walk，这条老底子杭州市井年味的线路也非常值得一走～ 	 🚶‍♀️Citywalk路线： 地铁“吴山广场”站👉河坊街👉大井巷👉鼓楼👉德寿宫👉地铁“江城路”站 ⏰用时：2h 	 🏮河坊街： 如果时间充裕，河坊街值得深入逛一逛，步行街上虽热闹但很多网红店，建议去小巷。 ▫️胡庆余堂中药博物馆（08：30 - 17：00） 全国首家中 药专题博物馆，在这里，我们可以深入了解中华五千年的中 药文化。 ▫️江南铜屋（09：00 - 22：00） 江南铜屋是由朱炳仁父子精心打造的艺术殿堂，整座建筑除墙面地面外全为铜质结构装饰。 	 🏮大井巷： 融合了百年老字号与众多新兴宝藏店铺，承载着老杭州的珍贵记忆，同时又充满了现代活力☕🍵 	 🏮鼓楼： 始建于五代时期的南朝，它静静见证着杭州的千年变迁，是杭州的标志性古建筑之一。 	 🏮鼓楼堂 1885年的基督教堂，1931年改建为中国宫殿式教堂，进到教堂里黄色玻璃让进来的光线全是金黄的圣光。 	 🏮南宋书店 在穿过鼓楼门之前，往左看有一幢灰色的大玻璃窗的建筑，享有“浙江蕞美书店”的美名🏅，青砖黑瓦和现代材质相呼应，是普利兹克建筑奖获得者王澍的建筑作品。 	 🏮德寿宫 杭州人自己的小故宫。其内宫殿与园林并置，宋高宗、吴皇后、宋孝宗、谢皇后等历史名人曾居住于此，见证了南宋的兴衰。从北门出去后, 宫外有一面红墙，大约有一百多米长，每年都会精心布置新年装置。 	 #城市漫步计划[话题]# #杭州旅游[话题]# #chinatravel[话题]# #城市探寻计划[话题]# #中式旅行天花板[话题]# #一眼就心动的中国古建[话题]# #杭州旅游攻略[话题]# #河坊街[话题]# #德寿宫红墙[话题]# #派兔旅行[话题]#","城市漫步计划, 杭州旅游, chinatravel, 城市探寻计划, 中式旅行天花板, 一眼就心动的中国古建, 杭州旅游攻略, 河坊街, 德寿宫红墙, 派兔旅行"
快码住这条杭州植物园citywalk攻略,请大数据推给要来杭州旅游的朋友 杭州植物园有六千多种植被，被称为植物博物馆 开放时间8:30- -16:30门票10元早上八点前或者下午五点之后入园免费 出行:建议直接打车到植物园北门or坐89公交车到浙大玉泉站步行10分钟到植物园北门 路线:植物园北门(人口)→山水园-→玉泉鱼跃→百草园- >韩美林艺术馆-→水生植物区-→植物园青芝坞门(出口) 山水园的睡莲开的满满的岸边也有不少用手机也可以拍的很清楚睡莲的上班时间是早上7:00-下午15:00左右要观赏睡莲的朋友情赶着这个时间段噢它们可是植物界的公务员有下班时间哒 玉泉鱼跃里面的鱼超级超级肥美每条都比我大腿还大! 韩美林艺术馆免预约开放时间:周三一周一9:00-16:30周二闭馆要拍大佛头的朋友周二闭馆日照常开放9:00-18:00 水生植物区有大片大片的草坪走累了坐在路边的椅子上晒晒太阳非常治愈 最后从青芝坞门出去顺路逛逛青芝坞环境非常好的生活区也有餐厅可以用餐 #一起去山林吸氧[话题]# #一个人的旅行[话题]# #旅游攻略[话题]# #杭州[话题]# #徒步[话题]# #徒步路线推荐[话题]# #游玩攻略[话题]# #假日citywalk[话题]# #人文景点分享[话题]# #大自然[话题]# #野餐[话题]#,"一起去山林吸氧, 一个人的旅行, 旅游攻略, 杭州, 徒步, 徒步路线推荐, 游玩攻略, 假日citywalk, 人文景点分享, 大自然, 野餐"
原来这才是杭州citywalk不可错过的三条路线,校园民工的寒假又来啦 刚结束和闺蜜的三天两晚杭州citywalk 街头年味已经铺满 太适合citywalk啦 迫不及待要跟你们分享我这次走过的三条citywalk路线: 	 Day1️⃣ 西湖路线（第一次到杭州这条路线肯定是少不了的） 龙翔桥地铁站[向右R]湖滨[向右R]公园码头[向右R]三潭印月[向右R]花港观鱼[向右R]太子湾公园[向右R]雷峰塔[向右R]观光车过苏堤[向右R]西冷桥[向右R]孤山[向右R]白堤[向右R]断桥残雪[向右R]武林夜市[向右R]凤起路地铁站 [红书R]tips: 🔉这一圈走下来十几公里，预留一天时间。如果平时不怎么走路就有点费腿，可以🚢游船＋🏍电瓶车＋🚶步行 🔉龙翔桥地铁站步行到钱王祠码头坐船到花港观鱼码头 🔉:苏堤坐观光车吧，真的费腿。不过对日均2w步的我来说还行[哇R][哇R] 🔉西泠桥看日落吧，绝美！ 	 Day2️⃣ 大运河路线（我真的太爱这条路线了） ⑤号线大运河站[向右R]拱宸桥[向右R]桥西历史街区（特别适合遛娃）[向右R]小河公园[向右R]小河直街[向右R]大兜路[向右R]香积寺[向右R]③号线香积寺站 [红书R]tips: 🔉桥西历史街区:藏着四个博物馆（伞和扇，刀剑剪，遛娃一定不要错过） 🔉小河公园:浓浓工业风 🔉小河直街:小桥流水，白墙黛瓦，有很多特色文艺小店。 🔉大兜路:梧桐路上的清末明初古建筑和现代文艺相结合，各种创意餐厅和咖啡厅，特别适合打卡。 🔉香积寺:大隐隐于市的宋韵古庙，国内唯一供奉厨神的古庙，那里的素面巨好吃！ 	 Day3️⃣ 茶山秘境路线（这条路线真的太适合徒步爱好者） 龙井村[向右R]九溪烟村[向右R]理安寺[向右R]杨梅岭[向右R]白鹤峰 [向右R]汤屋[向右R]下满觉陇[向右R]石屋洞[向右R]四眼井 [红书R]tips: 🔉可以坐27路或者87路公交到达龙井村，龙井村到九溪的路比较平坦，适合老人小孩，夏天还可以玩水。 🔉龙井村有很多茶室，走累了可以坐下喝茶，大概0每位，路边村民给你推荐的茶叶请谨慎。 🔉九溪烟村巨美，茶园古道，瀑布溪流，真的羡慕杭州人民可以不出市区就能拥有这片世外桃源。 🔉即使不是丹桂飘香的季节，满觉陇也是值得一去的，各种文艺咖啡厅，还有“千与千寻”同款汤屋。从汤屋旁的小路上去就是当年李叔同创作『送别』的古道，山上可以俯瞰整个西湖哦！ #西湖美景如画[话题]# #上有天堂下有苏杭[话题]#  #城市的一百种玩法[话题]# #城市探索家[话题]# #城市游走计划[话题]# #发现城市好去处[话题]# 杭州真的太适合citywalk了 趁着春节假期 大家一起走起来吧,"西湖美景如画, 上有天堂下有苏杭, 城市的一百种玩法, 城市探索家, 城市游走计划, 发现城市好去处"
别在找了，最全的杭州旅游攻略❗️码住,一张图看懂怎么玩转杭州精华景点 先收藏起来⭐️，肯定要用到的 · 📍杭州地铁沿线景点 ✔1号线：西湖景区、南宋御街、河坊街、十五奎巷西湖十景、京杭大运河 ✔2号线：西湖、良渚文化村 ✔3号线：浙江省博物馆、西溪湿地国·家公园、宝石山植物园 ✔4号线：丝绸博物馆、六和文化公园 ✔5号线：京杭大运河博物馆 ✔6号线：云栖小镇、灵山景区、宋城 · 💡出行小提示 1、杭州站、杭州东站都离西湖较近，买票建议选这两个火车站 2、去灵隐寺要买两次门票，飞来峰景区门票45和寺庙门票30 3、灵隐寺附近还有法喜寺、财神庙，可以一起逛 4、遇到大风大雨等恶劣天气，西湖游船不开放，别跑空了，想坐摇橹船可以提前在网上预yue好 5、西湖景区都是石子路，寄存点少，拉着箱子非常难走，不要带行李去景点 · 🧡去杭州可以做的事 🔅去南宋御街感受市井生活 🔅去湖滨银泰in77感受潮人聚集地 🔅去住一家直观西湖的民宿 🔅去灵隐寺上香，祈福一生平安喜乐 🔅去宝石山，和心爱之人欣赏日落 🔅去西湖，看波光粼粼和很美的日落 · 🥓杭州美食🥓 👍杭州打卡美食 🌟茶人村 •水墨西溪 杭州旅游必吃！藏在水墨西溪的茶人村，杭帮菜绝对让你欲罢不能湿地国家公园里的茶人村，就像是进入了仙境一般。古香古色的两层楼餐厅 #杭州[话题]# #杭州旅游攻略[话题]# #杭州旅游[话题]# #杭州美食[话题]# #杭州拍照[话题]##寒假旅游攻略[话题]# #西湖游玩路线[话题]# #西湖旅游攻略[话题]# #杭州citywalk[话题]# #杭州蛇年旅游攻略[话题]#,"杭州, 杭州旅游攻略, 杭州旅游, 杭州美食, 杭州拍照, 寒假旅游攻略, 西湖游玩路线, 西湖旅游攻略, 杭州citywalk, 杭州蛇年旅游攻略"
