title,desc,tags
来杭州，一定要逛下西湖边的坠美南山路‼️,来杭州玩除了西湖，一定要逛逛这条充满艺术气息和浪漫风情的南山路呀！ 一边是西湖美景，一边是风格各异的历史建筑。道路两旁的大梧桐树遮天蔽日，走在树荫下，满目的绿色，心情都变得轻盈起来～租辆自行车🚴或者悠闲地散个步，感受这份难得的宁静与美好🥰 	 🎨浙江美术馆 西湖边的美术馆，不定期会有各种展览，之前很火的雕塑展就是在这里～直接刷身份证进入参观，无需预约 	 ⛲️长桥公园 雷峰夕照打卡地，适合看日落，远望能看到雷峰塔 	 🍃柳浪闻莺 西湖十景之一，满眼的绿意，拱桥倒影，杭州的绿野仙踪 	 🏛️钱王祠 是为了纪念吴越国的钱王而建造的，红墙黛瓦间透露着历史韵味🎫门票15r 	 🌈西湖博物馆 场馆不大但是非常有意思。展出了一些文化文物，介绍了西湖的发展起源等🎞重点推荐【西湖四序】3D投影沉浸式感受西湖的美景，拍照也超级出片！🆓不需要预约 	 🗿勾山里 百米长，宽6米的青石板坊巷，墙上有铜版画，介绍了勾山里的历史。地方不大，路过参过即可～ 	 🖼️恒庐美术馆 民国建筑，旁边还有潘天寿纪念馆，可以免费参观 	 📚南山书屋 在灰砖洋楼的小别墅里，店内很安静，灯光较暗，卖的基本上是艺术类书籍，静心阅读的好去处～ 	 🎓中国美术学院南山校区 建筑和自然完美融合，校园里随处可见的雕像和爬山虎。可预约入校参观，感受艺术的气息！ 	 🌳西湖天地 有一片空旷的草坪，附近有很多餐饮店，逛累了可以休息 #杭州旅游[话题]# #杭州citywalk[话题]# #西湖边景美人少的好去处[话题]# #就要逛公园[话题]# #秋游记[话题]# #不辜负每个周末[话题]# #不为打卡的旅行[话题]# #杭州周末去哪儿[话题]# #攻略[话题]# #西湖[话题]#,"杭州旅游, 杭州citywalk, 西湖边景美人少的好去处, 就要逛公园, 秋游记, 不辜负每个周末, 不为打卡的旅行, 杭州周末去哪儿, 攻略, 西湖"
近期来杭州‼️不要错过这条运河citywalk,近期来杭州 不要错过这条运河citywalk路线 . 👉路线 濮家站-运河水上巴士1号线-信义坊码头-富义仓-香积寺-大兜路历史街区-小河直街-小河公园-中国大运河博物馆-拱宸桥-桥西历史街区-中国伞博物馆-中国刀剪剑博物馆 . #杭州京杭大运河水上巴士1号线[话题]# #信义坊[话题]# #富义仓[话题]# #香积寺[话题]# #大兜路历史街区[话题]# #小河直街[话题]# #小河公园[话题]# #拱宸桥[话题]# #中国大运河博物馆[话题]# #桥西历史街区[话题]# #中国伞博物馆[话题]# . ‼️tips [一R]这条路线如果你想要逛博物馆，建议上午开始逛起，如果你下午来的，又想逛博物馆，建议直接坐到拱宸桥下船。 [二R]这条路线适合先逛香积寺的，如果带小朋友的可以坐到拱宸桥开始逛起，后面会专门分享一条带娃的路线 [三R]这条路线串联了运河边的博物馆，记得提前工号上约，周一周二闭馆 . #我的春节这样过[话题]# #春节去哪儿[话题]# #杭州周末去哪儿[话题]# #杭州旅游[话题]# #杭州旅行[话题]# #杭州[话题]# #西湖[话题]# #西湖美景[话题]# #杭州拍照[话题]# #杭州Citywalk[话题]# #杭州老街[话题]# #运河[话题]# #杭州[话题]# #假日citywalk[话题]# #citywalk[话题]# . #你是什么时候来杭州 [投票]#,"杭州京杭大运河水上巴士1号线, 信义坊, 富义仓, 香积寺, 大兜路历史街区, 小河直街, 小河公园, 拱宸桥, 中国大运河博物馆, 桥西历史街区, 中国伞博物馆, 我的春节这样过, 春节去哪儿, 杭州周末去哪儿, 杭州旅游, 杭州旅行, 杭州, 西湖, 西湖美景, 杭州拍照, 杭州Citywalk, 杭州老街, 运河, 假日citywalk, citywalk"
杭州必打卡7条特色步行街！！！,[一R]湖滨步行街 杭州的市中心，有超级多商场：工联CC、湖滨银泰等。B区地下有很多快闪店，内娱韩娱二次元都有。D区有一家很大的乐高店，门口是乐高版三潭印月！出来还可以西湖漫步，不定期有集市哦~ [星R]推荐：工联CC负一楼的美食城，超级多小吃，喜欢脆皮年糕，还有甜丫丫甜品店。 	 [二R]南宋御街/河坊街 两条街是连着的，晚上很热闹，街上超多小吃店、特产店，可以边走边吃，很多商家藏在一些小巷子里面（比如西泠印社、文艺咖啡店），走走拐拐会经过鼓楼到十五奎巷，可以走到吴山上，体验感蛮好。 [星R]推荐：羽和铃咖啡店，环境超级好，很出片哦（不可以商拍）。 	 [三R]小河直街 “一座拱宸桥，半部杭州史”，这边有小河流水，还有老杭州的印记，小河直街有很多文艺小店，有很多簪花体验店，小巷子曲曲折折的探索体验感很好。 [星R]推荐：欢桔餐酒空间和Lucky吉时餐吧，两家餐厅都能看到河边风景，现在这个气温边吃饭边聊天边吹风体验感超棒！ 	 [四R]河渚街 在西溪湿地公众开放区，整个街区以白墙黑瓦为特色，很多小吃店还有纪念品店（西湖十景还有西溪十景的章都可以在这里盖哦），这里基本上能买到所有杭州特色小吃：捣麻糍、葱包烩、藕粉等等。 [星R]推荐：杨先生糕点文化体验馆，推荐他们家的芡实糕和肉松小麻花！ 	 [五R]玉鸟集 算是杭州目前比较热的打卡点啦，视觉体验做的很丰富，在这条路上逛一点都不干巴！街边很多餐厅、手工店、奶茶店、首饰店等，很多蛮有意思的小店，网红餐厅也很多，旁边还有大屋顶书店！ [星R]推荐：catcat饰品店，装修以木色为主，有一整面墙的饰品，不买也可以逛很久。 	 [六R]闲林老街 小桥流水、白墙黛瓦、古色古香，清净人少超级好逛！还有一个大草坪可以野餐露营，毛孩子可以尽情撒野，小朋友也可以在这里撒欢奔跑，晒晒太阳，真的很舒服~运气好还能遇到好玩的市集！ [星R]推荐：老头儿油爆虾，老底子的杭州味~ 	 [七R]瓶窑老街 至今已有600多年的老街，青砖灰瓦的建筑风格保留了明清时期的特色，漫步在瓶窑老街上，仿佛穿越了时空，回到了那个古朴典雅的年代。精致好拍的非遗造物空间，保留年代感的老电影院，各具特色的非遗博物馆…… [星R]推荐：自然造物一定要去打卡，比宜家还好逛的传统手艺店！ 	 （部分图源网络，侵删） 	 #杭州[话题]# #旅游推荐[话题]# #旅行[话题]# #citywalk[话题]# #步行街[话题]# #走街串巷找[话题]#,"杭州, 旅游推荐, 旅行, citywalk, 步行街, 走街串巷找"
不用去西湖边人挤人，在杭州20元独享一座岛…,西湖留给外地游客，湘湖变成我的后花园🤗 湖面开阔、花海垂柳🌿 湘湖的美，一点也不输西湖 	 逛湘湖的时候发现了游船路线🗺 20元船票来回 就可以在湖心的小岛上度过一个下午 掬星岛从空中俯瞰像是一颗爱心 因为知道的人不多，直接独享一整艘画舫船 刚上岛的时候还以为去到了泰国度假地 摇椅、佛像，绿意环绕🎐 岛不大，5分钟就走完了，但是空间景色多样 有亲水露台、禅意茶室、咖啡屋、室外露营地 感觉超适合办婚礼party、团建活动的！🎉 点上一壶茶，约三五好友 躺在大自然里看山看水，或者打牌聊天也太美了🥳 	 📍地址：窑里坞码头 🚇地铁湘湖站下，打车5分钟到 🚌公交707路窑里坞下 🚗自驾至停车窑里坞停车场 在码头坐船至掬星岛，船票20元🎫来回 售票时间：9:00-16:30 🎫门票：🆓，建议提前预约哦～ 	 🌟湘湖周边景点推荐 🌊杭州极地海洋公园：有各种海洋生物的表演，海象、海豚🐬、海狮、白鲸… ⛵️跨湖桥博物馆：世界上年代坠早的独木舟🛶，以船为整体造型，是特色景点。周一闭馆 🌺荷花庄：夏天一大片荷花，远处凉亭、阁楼，满满的江南韵味 🧗‍♀️老虎洞：可以爬山俯瞰湘湖 🦆大黄鸭乐园：租一辆大黄鸭游船，野餐、看绣球花，超有春日氛围～ #杭州周末去哪儿[话题]# #湘湖[话题]# #杭州湘湖[话题]# #露营[话题]# #假日citywalk[话题]#,"杭州周末去哪儿, 湘湖, 杭州湘湖, 露营, 假日citywalk"
来杭州一定一定要先看这篇攻略‼不踩雷👍️,💯杭州旅游攻略～建议收藏备用哦~ 🌈送给来杭州旅游的姐妹‼ - Day1⃣ 📍西湖—断桥残雪—曲苑风荷—平湖秋月—雷峰塔—苏堤 📍除了雷峰塔收门票💰40r🕑开放时间：8:00-17:00 其余地方都免费✅ 全天畅玩✅ 关于美食： 楼外楼（排雷❌） 基本每个菜都又贵又难吃 西湖醋鱼格外难吃！ 如果想体验西湖美景 可以点一杯茶🍵在二楼庭院喝 除非是稻米朋友 否则千万别来！ - ✅小吃推荐： 桂花糖藕 素烧鹅 葱包烩 小笼包 片儿川 肉丝拌川 - Day2⃣ 灵隐寺—法喜寺—杭州博物馆—河坊街—南宋御街 📿灵隐寺 💰门票：30r 🕑开放时间：6:30-18:30 🙏法喜寺 💰门票：10r 🕑开放时间：6:30-18:30 📖杭州博物馆 💰门票：免费 🕑开放时间：9:00-16:30 🏠河坊街 💰门票：免费 🕑开放时间：全天 🚇交通：由杭州博物馆步行3分钟🚶 🏯南宋御街 💰门票：免费 🕑开放时间：全天 🚇交通：由河坊街步行5分钟🚶 - Day3⃣ 📍西溪湿地—杭州植物园—小河直街—拱宸桥—武林夜市 🌳西溪湿地 💰门票：80r 🕑开放时间：7:30-17:30 🌵杭州植物园 💰门票：10r 🕑开放时间：8:30-16:30 🪵小河直街 💰门票：免费 🕑开放时间：全天 🚇交通：由植物园驾车20分钟 🪹拱宸桥 💰门票：免费 🕑开放时间：全天 🚇交通：由小河直街驾车8分钟 🍖武林夜市 💰门票：免费 🕑开放时间：17:00-22:00 🚇交通：由拱宸桥驾车30分钟 ⭕住宿🏨 建议住在西湖文化广场/龙翔桥/凤起路/武林广场附近！ 临近一号线🚇交通方便 · 🍜美食 1⃣灵隐寺斋饭（推荐✅） 有长生面和长寿面 还有很多素菜 好吃不贵 2⃣老头儿油爆虾（推荐✅） 商场里的店 不排除预制菜的成分 味道不出错 很经典的浙菜口味 - #旅游攻略[话题]# #假日citywalk[话题]# #杭州旅游[话题]# #大学生[话题]# #杭州[话题]# #旅游[话题]# #旅游攻略[话题]# #人文景点分享[话题]# #假期去哪玩[话题]# #假期旅游[话题]# #旅行推荐官[话题]# #西湖[话题]# #灵隐寺[话题]# #杭州西溪湿地[话题]# #南宋御街[话题]# #宋城千古情[话题]# #小河直街[话题]# #良渚古城遗址公园[话题]# #旅行[话题]# #周末去哪儿[话题]#,"旅游攻略, 假日citywalk, 杭州旅游, 大学生, 杭州, 旅游, 人文景点分享, 假期去哪玩, 假期旅游, 旅行推荐官, 西湖, 灵隐寺, 杭州西溪湿地, 南宋御街, 宋城千古情, 小河直街, 良渚古城遗址公园, 旅行, 周末去哪儿"
杭州大运河citywalk路线🌟历史文化街区打卡,总是带朋友去逛西湖 这次来点不一样的 沿着大运河走这条路线 感受到杭州浓浓的历史文化氛围～ - ⭕️推荐路线：京杭大运河博物馆➡️拱宸桥➡️桥西历史文化街区➡️小河公园➡️小河直街➡️大兜路历史文化街区➡️香积寺 🔸 全程大约3km，边逛边拍 - ✅【京杭大运河博物馆】：📍🚇拱宸桥东，步行 700米左右就到了，主要是介绍了大运河的历史文化，9:00-16:00，周一闭馆 ✅【拱宸桥】：是京杭大运河的起点，“一座拱宸桥，半部杭城史”。站在拱宸桥上看来往船只和两岸风景 ✅【桥西历史文化街区】：旁边就是运河，有3个博物馆，可以参观了解传统工艺，免费，免预约 🔺中国扇博物馆 🔺 中国伞博物馆＋刀剪剑博物馆 ✅【小河公园】：工业风满满，大油桶建筑很特别，绿化很好，拍照很出片 🔺甲M+摩登夫妇：各类陶瓷制品小店，有两层，非常好逛 ✅【小河直街】：宝藏小街，有三条街，整体不大但很精致，拍照很出片！很多网红咖啡店、茶馆，还可以体验簪花；夜景也很美～ ✅【大兜路历史文化街区】：比起小河直街，这里人更少，古朴宁静，有很多咖啡馆、文艺店铺，晚上路边会摆集市小摊 ✅【香积寺】：寺院，闹中取静，门票20r，免预约，开放时间8:00-17:00；素斋很有名，还可以请手串 - 📌tips： 1️⃣直接去小河直街📍🚇10号线北大桥D出口，🚶步行15分钟 2️⃣小河直街现在是簪花一条街，能周末想体验的需要早点去 3️⃣附近商场有远洋乐堤港、大悦城，吃饭逛街都很方便[偷笑R] 🟡一些总结： 这一趟走了4个小时（包括吃了个快速饭），沿着大运河，空气好、环境美、小店多，可以感受到杭州的城市文化氛围！散步闲逛推荐！👏 #杭州[话题]# #杭州旅游[话题]# #城市漫步计划[话题]# #探寻城市计划[话题]# #小众游玩路线[话题]# #本地人的路线都是这样[话题]# #小河直街[话题]# #大运河[话题]# #citywalk[话题]# #闲逛[话题]#,"杭州, 杭州旅游, 城市漫步计划, 探寻城市计划, 小众游玩路线, 本地人的路线都是这样, 小河直街, 大运河, citywalk, 闲逛"
比起西湖，我更爱这条充满浪漫色彩的街巷❗,[郁金香R]杭州集浪漫、惬意、美好于一体的地方，就是这个转角遇见过去岁月的街区— —位于京杭大运河南端标志的拱宸桥西面— —桥西历史文化街区[哇R][哇R][哇R] . 📍地点：桥西历史文化街区 ⏰时间：全天开放（建议18：00之后去，不然太热了❗️❗️❗️） 🚏出行：Ⓜ️地铁5号线大运河站、拱宸桥东站 🚌公交：拱宸桥西站 🚤水上巴士：拱宸桥站 . [飞吻R][飞吻R][飞吻R] 街区怎么吃❓ [一R]早餐：游埠豆浆 一碗咸豆浆+葱包烩包油条=完美搭配[派对R] （当然，排队人老多，建议早去或者工作日去） . [二R]中餐：芒种 入选米其林指南的面馆哦，可以去尝试一下 . [三R]晚餐：同源里·院子餐厅 （上期有介绍，就不多做介绍了哈，总之很好吃） . [四R]中医一条街 去方回春堂喝一杯中药版酸梅汤，对于这炎炎夏日来说，简直不要太合适（刚喝过，巴适得很[偷笑R]） . [飞吻R][飞吻R][飞吻R] 街区怎么玩❓ [一R]博物馆超多 门口就是中国扇博物馆，旁边是手工艺活态馆，拐角就可以遇见中国刀剪剑博物馆，附近还有京杭大运河博物馆、中国伞博物馆、杭州工艺美术馆，完完全全是个#博物馆打卡[话题]# 盖章圣地[哇R][哇R][哇R] . [二R]拱宸道院张大仙庙 开放至：21：30 庙里有小猫在树下乘凉，完美风景[黄金薯R][黄金薯R][黄金薯R] . [三R]运河桥西财神庙 终于开放啦！！！ 庙里供奉了九座财神，全方位拜一遍❗️就不信会拜错❗️心中默念（富贵砸我脑袋上，富贵砸我脑袋上，富贵砸我脑袋上） . [四R]晓风书屋 #稻米[话题]# 们可以去打卡盖章哦，南派三叔主打书店，里面还有《盗墓笔记》的周边哦[烟花R][烟花R][烟花R] . [五R]中国大运河石碑 游客聚集打卡圣地，拍一张游客照证明我来过❗️ . [庆祝R]桥西历史文化街区，是历史沉淀的产物，在这里散步，随时都可以捡拾起历史的记忆哦❗️ . #运河[话题]# #citywalk[话题]# #Citywalk运河明珠[话题]# #灵魂和肉体都在路上[话题]#,"博物馆打卡, 稻米, 运河, citywalk, Citywalk运河明珠, 灵魂和肉体都在路上"
刚从杭州回来：你必须知道的一日游经典路线,去了杭州，本地姐妹带我打卡，绕西湖一周的蕞强攻略！ ❤超级浪漫的1314路公交坐了！只有本地人知道的15R西湖游船坐了！ 🟦行程： ✅上午：灵隐寺、飞来峰、法喜寺 ✅下午：花港观鱼、苏堤、西湖游船（会看到三潭印月和雷峰塔）、西湖博物馆 ✅晚上：吴山广场、河坊街、南宋御街、鼓楼 🟧吃饭： ✅早上：酒店早餐 ✅中午：法喜寺5元素食or湖畔居（花港观鱼店）片儿川 ✅晚上：南宋御街的苍蝇小馆！！ 💛因为要去灵隐，所以我们起的很早，6点多就起床了。如果你能够早起，只有一天时间，可以直接抄作业！如果起不来，就可以把下午的博物馆和图书馆行程去掉，一天也是正正好！ 😘这条路线环西湖一周，公交+游船+citywalk！全都是zui精选的经典景点+小众省钱玩法+百年老店按利！ #杭州[话题]# #西湖[话题]# #灵隐寺[话题]# #杭州一日游[话题]# #杭州旅游[话题]# #法喜寺[话题]# #花港观鱼[话题]# #西湖游船[话题]# #杭州周末去哪儿[话题]# #本地人做的攻略[话题]#,"杭州, 西湖, 灵隐寺, 杭州一日游, 杭州旅游, 法喜寺, 花港观鱼, 西湖游船, 杭州周末去哪儿, 本地人做的攻略"
杭州｜拱墅区Citywalk游玩攻略,#周末去哪儿[话题]# 📍搭乘水上巴士至拱宸桥码头 乘坐1号线到「武林广场」B口出，步行到武林码头，乘坐一号线3r水上巴士，到拱宸桥下船。 ⭐️工作日往返路线：濮家-艮山门-武林门-信义坊-拱宸桥-运河天地 运营时间：7:00-18:00 ⭐️非工作日往返路线：武林门-信义坊-拱宸桥-运河天地 运营时间：7:20-18:36 🫶具体可以关注vx公众号：运河水上巴士 周末节假日人巨多 旁边的游览专线是30r一人 稍微快一点～ 📍信步桥西街区 领略传统手工艺术 杭州工艺美术博物馆和手工艺活态馆坐落在此，街区的店铺以传统手工艺展开，古香古色，文化气息浓厚 🚶‍♀️步行167m约11min→拱宸桥 🚶‍♀️步行268m约3min→中国扇博物馆 🚶‍♀️步行485m约10min→中国刀剪剑博物馆 🚶‍♀️步行157m约3min→中国伞博物馆 🚶‍♀️步行345m约6min→杭州工艺美术博物馆 📍 参观博物馆 感受历史的魅力 四座杭州工艺美术博物馆（中国刀剪剑、扇艺、伞艺博物馆）以及京杭大运河博物馆一字排开 从陶瓷、木雕、织品到刀剪剑、扇艺、伞艺，中国的传统手工艺，它们不朽的美丽都被展现得淋漓尽致。 ⭐️京杭大运河博物馆免预约 开放时间：9:00-16:30 16:00停止入场 周一闭馆 ⭐️杭州工艺美术馆需预约 gzh预约 四馆通用 无需分开预约 9:00-16:30 16:00停止入场 周二闭馆 📍 信步大兜路 参观香积寺 🎫20r 赠三支香 ⭐️可以买到开过光的手串 100-300r不等 🥗素斋：20/人 听说味道还不错 📍 游小河直街 逛遍古韵文艺小店 粉墙瓦黛，运河边的街区保留着砖木房，不管是做商铺还是住宅，都脱离不了古韵，最近又掀起了簪花的热潮，这里很适合年轻人扶着相机拍着花草鸟木、墙根裂痕，饮一杯咖啡享受片刻的静谧～ #杭州[话题]# #杭州旅游[话题]# #杭州旅游指南[话题]# #杭州游玩攻略[话题]# #拱墅区[话题]# #京杭大运河[话题]# #水上巴士[话题]# #citywalk[话题]# #拱宸桥[话题]# #京杭大运河博物馆[话题]# #小河直街[话题]# #桥西历史街区[话题]# #香积寺[话题]# #大兜路历史街区[话题]# #杭州博物馆[话题]# #香积寺手串[话题]# #香积寺祈福[话题]# #杭州寺庙[话题]#,"周末去哪儿, 杭州, 杭州旅游, 杭州旅游指南, 杭州游玩攻略, 拱墅区, 京杭大运河, 水上巴士, citywalk, 拱宸桥, 京杭大运河博物馆, 小河直街, 桥西历史街区, 香积寺, 大兜路历史街区, 杭州博物馆, 香积寺手串, 香积寺祈福, 杭州寺庙"
杭州city walk一日路线！四种路线轻松秒懂,杭州的街巷实则蕴藏无限摄影灵感 我倾心筹备了一份详尽的一日杭州city walk攻略 四个方案供你选择 内含多个绝美拍摄点 周末好去处~假日赏秋 小仙女们快来杭州，亲身感受这座江南水乡的独特韵味与都市风采吧~ —— 📍City Walk路线参考① 🌊大运河畔，穿越时空的漫步✨ 运河广场➡大运河博物馆➡拱宸桥 ➡桥西历史文化街区 ➡小河直接历史文化街区 ➡香积寺➡富义仓遗址公园 ➡信义步行街 . 📍City Walk路线参考② 🧘‍♂️灵隐禅意，寻觅心灵的宁静🍃 北高峰索道 ➡灵顺寺 ➡韬光寺 ➡永福寺 ➡灵隐寺 ➡法镜寺 ➡法净寺 ➡法喜寺 . 📍City Walk路线参考③ 🏞️西湖畔，浪漫与诗意的邂逅💖 IN77银泰 ➡游船码头 ➡三潭印月 ➡花港观鱼 ➡太子湾公园 ➡雷峰塔 ➡曲院风荷 ➡北山街 ➡武林夜市 . 📍City Walk路线参考④ 🍂赏秋秘境，杭州的金色童话🍁 九溪烟树 ➡理安寺 ➡杨梅岭 ➡白鹤峰 ➡汤屋 ➡下满觉陇 ➡石屋洞 ➡四眼井 —— 以上四条路线各具特色 👣 无论是喜欢历史文化、自然风光还是秋季美景的朋友 🏞️ 都能在杭州找到属于自己的CITY WALK路线✨ 希望您在杭州的旅途中 🍂 能收获满满的快乐和美好回忆😄 让我们一起在杭州的街头巷尾，留下最灿烂的笑容和最美好的瞬间吧🎉 —— 📝旅行小贴士 🚆选好起点，注意杭州有两个站，南站和东站，选择比较近的车站 👟整天游走于城市之间，记得给自己的双脚选双超舒适的鞋子哦，让每一步都轻松自在！ 🍫小饿小困怎么办？随身带点小零食，随时补充能量，远离低血糖的小困扰！ ☀️虽然秋季不是很热，但防晒防暑不能忘！带上你的防晒神器，让阳光也温柔以待~ #杭州citywalk[话题]#  #杭州旅游[话题]#  #杭州旅游攻略[话题]#  #杭州city_walk[话题]#  #杭州citywalk路线[话题]#  #杭州小众旅游地[话题]#  #杭州美食[话题]#  #杭州徒步[话题]#  #杭州徒步路线[话题]#  #杭州citywalk好去处[话题]#  #杭州旅游指南[话题]#,"杭州citywalk, 杭州旅游, 杭州旅游攻略, 杭州city_walk, 杭州citywalk路线, 杭州小众旅游地, 杭州美食, 杭州徒步, 杭州徒步路线, 杭州citywalk好去处, 杭州旅游指南"
杭州市井citywalk一日游,杭州citywalk共有4条网红线路，如果你选择在春秋天来，可以选择走孤山路的西湖边路线；如果你是冬天过来可以试试这条市井路线，兼顾了历史、文化和风景。 杭州市中心开车其实不方便，想要走这条线路的朋友推荐住在河坊街附近，因为要走的景点都在这个附近，河坊街属于是这条路线的中间点。 早晨起来在酒店吃完早饭，第1站可以去浙江博物馆。虽然现在比较网红的是他新开的馆，但是这个馆里的良渚玉器，龙泉御窑瓷器，吴越国精品也是很值得一看的，当然最值得一看的还是那个黄金漆器轿子。 从杭州博物馆出来，对面就是河坊街。上午逛累了可以选择在这里吃个午饭。这条路上商业气息很浓，小吃和创意杭帮菜也很多。如果不是节假日过来，很多饭店在大众点评上都有优惠，性价比很高（推荐杭小馆）。 这条市井线路最大的优点就是每处距离都不远。河坊街一直往前溜达4~5分钟就到了大井巷。这里现在被改建成了咖啡一条街，特别醒目的是街口的胡庆余堂人参拿铁，个人觉得味道还不错。虽说这里的市井都有一些破破旧旧的，但是却很有生活气息，随意看看那些人来人往的人和街边的小铺，那就是生活本该有的方式。 继续往前走穿过鼓楼和马路，对面是胡雪岩故居和南宋德寿宫遗址博物馆。时间允许的朋友可以先去看胡显岩故居，非常有江南细节的庭园（如果在枫叶季过来是最好的）；如果时间比较紧张但又对南宋历史比较感兴趣的朋友，推荐一定要看一下南宋德寿宫遗址博物馆（记得一定提前通过公众号预约）。本来以为里面不太大，谁知道逛着逛着发觉还是挺大的，慢慢看，最起码要安排2个半到3个小时，博物馆出口的网红咖啡和红墙记得打卡哦。 这些地方都逛完，如果天气晴朗还有体力，可以走去城隍阁看个日落，这里可以俯瞰整个西湖；如果体力不够了，远眺个亮灯的城隍阁夜景也不错。 整条线路步数大约在22000步，这次是特地来看赵无极百年回顾展。看完对面的钱王祠里有个网红咖啡☕可以试试，就是要花15元门票钱。 #2023我的旅行故事[话题]# #看展[话题]# #旅游[话题]#,"2023我的旅行故事, 看展, 旅游"
