title,desc,tags
这条citywalk0️⃣元打卡❸个绿野仙踪网红机位,走走停停拍照3小时，1.5w步，这条citywalk可以打卡三个“绿野仙踪”网红机位，西湖边的“秘境”地图🗺️p18，不走回头路。 1️⃣积义亭 2️⃣白蛇飞渡桥 3️⃣柳浪闻莺新横河桥 	 🤳拍摄时间：2024.9.25 	 🏃【徒步路线】 吴山广场 →积义亭 →革 命 纪念馆→万松书院/白蛇飞渡-长桥公园 （📷雷锋夕照）→南山路/浙江美术馆/学士公园→柳浪闻莺 🚇：吴山广场D出口 1️⃣ 积义亭：吴山的绿野仙踪 🚶路线：吴山广场D出口 ➡️右转上山， 【喂鸽亭】（5r一包），路口左转再右转5-6分钟到【江湖汇观亭】p4 拍城隍阁、保俶塔同框。远眺西湖美景。p5 现在栾树红了hen漂亮。往下走看到图⑥ 【积义亭】指示↗️右上 p6 拍人与景的话需要广角镜 	 2️⃣白蛇飞渡桥 打卡蔡依林走过的“爱情诗路”，万松书院外侧 🚶路线：积义亭往前左转看到一条木栅栏小路（p6右下）往左下方，途中有【革 命烈士纪念馆】 p9 穿过万松岭路看到【节义亭】p11（双节义碑：用于纪念“贫困守志，至死不移”的崔升夫妇），继续往右走50米。 📷机位 ❶摄影师入口马路上对面拍 ❷往前走一点（树）人站马路上方的桥段，如果同时下面有人走过，意境👍 ❹桥另一端小山坡，可拍全景 	 3️⃣ 长桥公园 p15 傍晚天气好的时候，可以拍“雷锋夕照”，长椅上休息看游船或野鸭、拍照氛围感👍 	 4️⃣学士公园 p14 高耸的杉树下红色长椅，黄的彼岸花开得正好，隔开南山路的喧闹，留下一处幽静之地，赏荷拍古风👍 	 5️⃣柳浪闻莺-新横河桥  p17 西湖十景之一，位于南屏山下的柳浪桥。在桥上听到莺鸟悦耳的啼鸣声，非 常美妙动人。桥上和桥下各站一个人，蛮有意境的呀 p3 	 🚶路线：p16 大门进去右手边有棵柳树的石板路➡️【闻莺馆】的景观石左转，往前走几步右转下去。人多需要排队。春天秋天蕞美。 	 【实 用 tips】 ❶从柳浪闻莺对面【勾山里】穿过去右转3分钟左右回吴山广场，逛花鸟市场、南宋御景，河坊街、鼓楼、胡雪岩故居等 ❷ 早上8-9点出发，到中午下来觅食，刚吃饭可以去银泰或高银街（河坊街的难吃） ❸‼️🌞 蚊虫 #城市探寻计划[话题]# #国庆慢慢游[话题]# #杭州游玩[话题]# #人少景美打卡地[话题]# #国庆我要慢慢玩[话题]# #国庆假期[话题]##杭州西湖[话题]#,"城市探寻计划, 国庆慢慢游, 杭州游玩, 人少景美打卡地, 国庆我要慢慢玩, 国庆假期, 杭州西湖"
杭州蛇年接运路线❗️从白蛇飞渡到吴山小巷,#不早起旅行日记[话题]#  #新年旅行第一站[话题]# #新年版citywalk[话题]# #用一场旅行跨进2025[话题]# #2024旅行结算[话题]# 杭州蛇年新春登高祈福，我推荐吴山。因为吴山，是名副其实的杭州第一山❗️而且这个路线，是“不早起旅行”的路线，懒人友好哦 ✅吴山必打卡点： 1⃣摩崖石刻 云居山石刻群，“吴山第一峰”石刻群，“第一山和紫阳书院”石刻，感花岩摩崖石刻，浙江体育会摩崖石刻，瑞石古洞石刻群 2️⃣古造像 通玄观造像，吴山大石佛，泼水观音造像，宝成寺麻曷葛剌造像，吴山弥勒佛造像，十二生肖石 3️⃣吴山脚下的古巷 白马庙巷，十五奎巷，大井巷，清河坊，城隍牌楼巷，大马弄等 4️⃣城隍文化与民俗大观 城隍阁，江湖汇观亭，东岳庙，药王庙，吴山大碗茶，伍公庙，阮公祠，三茅观 >>>>>>>>>>>>>>>>>>>>>>> 🚙🚙出行贴士： ✔️推荐公交+徒步： 起点的白蛇飞渡桥，可以坐公交车102路到“万松岭”公交站。终点十五奎巷最近的地铁站是7️⃣号线“吴山广场”站 #旅游编辑部[话题]# #先出发再说[话题]# #我的旅行要实况[话题]# #杭州[话题]# #吴山[话题]# @生活薯 @知识薯 @人文薯 @视频薯,"不早起旅行日记, 新年旅行第一站, 新年版citywalk, 用一场旅行跨进2025, 2024旅行结算, 旅游编辑部, 先出发再说, 我的旅行要实况, 杭州, 吴山"
杭州📍小河直街Citywalk，全程🈚️回头路,[扶墙R]还是不喜欢走回头路，所以没有回头路 [doge]信誓旦旦要Citywalk，但根本起不来 [害羞R]封面是略改善了一下，觉得像那么回事了 	 👣交通工具：🚇地铁➕🚶步行 ⌚️大概时长：5-6h 	 ⭐️行程改善 1️⃣香积寺（🚇地铁） 	 2️⃣香积寺 🈺营业时间：8:00-17:00，🎫门票：💰20 	 3️⃣大兜路历史街区 	 4️⃣远洋乐堤港 安排好时间，这里🉑吃饭 	 5️⃣小河直街 	 6️⃣小河公园 	 7️⃣桥西历史文化街区 有3个博物馆： 中国杭州工艺美术博物馆 杭州刀剪剑博物馆 中国扇博物馆 	 8️⃣大运河（🚇地铁） 	 🌟个人建议： 1、能早起➕能徒步就看改善版的，吃早午饭的可以参照第二版（是本人） 2、小河直街现在真的太商业化了，喜欢拍照📷可以去打卡，不然还是别去了 3、穿个舒服点的鞋，做好防晒 4、尽量公共交通，打车哪里都堵 	 #小河直街[话题]# #小河公园[话题]# #杭州周末去哪儿[话题]# #徒步路线推荐[话题]# #假日citywalk[话题]# #citywalk[话题]# #人文景点分享[话题]# #杭州旅游[话题]# #杭州徒步[话题]# #香积寺[话题]# #桥西历史街区[话题]# #徒步[话题]# #徒步路线推荐[话题]#,"小河直街, 小河公园, 杭州周末去哪儿, 徒步路线推荐, 假日citywalk, citywalk, 人文景点分享, 杭州旅游, 杭州徒步, 香积寺, 桥西历史街区, 徒步"
比起西湖，我更推荐这条Citywalk‼️,这次我选择了高铁出行🚄 深圳出发去杭州（全程6小时）😌 可能我是工作日出行，全程感觉睡一觉就到啦[害羞R] 在去义乌前，给杭州预留了两天时间（不是第一次来哦）杭州最近天气真的热但我个人认为没有深圳热，时不时有点小风吹着很舒服，下午晚上就很适合citywalk！大家记得做好防晒‼️ 第一次来杭州的宝子们可以码住这条先[哇R]说不定哪天就用到啦 	 ✅路线 武林门码头-富义仓-香积寺-大兜路历史文化街区-小河直街-武林路女人街-狮虎桥路-武林夜市-周边逛 	 ⚠️👀水上巴士1号线 只用3r就能够游遍大运河沿线，建议提前排队去窗边位置，一定要做好防晒！ 	 [爱心R]打卡景点 1⃣️香积寺 🎫门票：20（现场可以扫码） 今天我去的时候人很少，还挺适合逛逛拍照哒，而且可以吃斋饭，感兴趣的可以去哦 	 2⃣️大兜路历史文化街区 免费🎫 比较舒适惬意的一条街区，有一些比较小资舒适的店铺，大热天和朋友进去坐着喝一杯真的棒！（因为白天真的蛮热的） 	 3⃣️富义仓遗址公园 免费🎫 不定期举办各种展览，感兴趣的可以关注一下 	 4⃣️小河直街 我个人不是特别推荐[皱眉R]但是确实比较适合第一次去杭州的宝子们去体检，里面很多茶馆咖啡手作等店铺，艺术氛围不错，非常多的簪花体验拍照📷工作日也超多人，商业化比较重一点 	 5⃣️武林路&狮虎桥路 打车的时候师傅和我聊天说以前武林路女人街很有名的，现在越来越落寞了，当时店铺租金也是很高，但是现在进行了一些改造。我个人很喜欢这里[害羞R]墙绘&古着&夜市都很值得去看嘻嘻⭐️ 	 我下午去的时候人不多，女生很适合去拍美照，而且路上有很多有个性的小店，都很有feel很好看，适合喜欢古着的姐妹👭 	 6⃣️武林夜市 也是晚上很值得一去的地方，真的好热闹好多美食！要不是胃就那么一点，真的想都吃一遍哈哈哈！今天就选择了杭州本帮菜（金猪），味道真的不错诶！而且分量很足，我和闺蜜俩人点了三个菜吃的很饱很满足（我俩属于饭量大的[偷笑R]） 	 吃饱喝足一直沿着夜市逛逛逛，沿途有很多精致有趣的小店，小风吹着，真的很舒服！[哇R][爱心R]#杭州旅游[话题]# #杭州美食[话题]# #杭州旅游指南[话题]# #杭州周末去哪儿[话题]# #杭州拍照[话题]# #杭州周末好去处[话题]#,"杭州旅游, 杭州美食, 杭州旅游指南, 杭州周末去哪儿, 杭州拍照, 杭州周末好去处"
2.5日Citywalk记录西湖落日,路线推荐： 龙翔桥地铁站下， 贴着湖边走到断桥，景色真的很美。 一边走一边看到好看的景色记录下来。 最后到断桥，去星巴克拍那扇窗户的蓝调 #周末去哪儿[话题]# #透过相机与自然对话[话题]# #与自然对话20秒[话题]# #西湖美景[话题]# #冬天的西湖也好美[话题]# #Citywalk[话题]# #冬日慢生活[话题]# #西湖美景[话题]# #落日[话题]# #蓝调[话题]# @摄影薯 @生活薯 @薯队长 @薯条小助手 @户外薯,"周末去哪儿, 透过相机与自然对话, 与自然对话20秒, 西湖美景, 冬天的西湖也好美, Citywalk, 冬日慢生活, 落日, 蓝调"
杭州｜萍水街City walk🥯周末快乐逛吃路线‼,从面包甜品到咖啡，萍水街值得逛一下午！！ 	 🚇地铁：五号线萍水街站 🚙自驾：车可以停到城西银泰 	 🍫 巧可栗栗：巧克力专门店，品种超多，可以送人。有巧克力豆试吃，贴纸好看，还有可爱的巧克力造型小夹子 🧋 陈文鼎：买一送一的珍珠奶茶，很适合跟小姐妹人手一杯 🍞 慢熟：社区面包店，装修好看，面包种类丰富，每次进去都要买一两个，他们家的周边也很好看 🥖 甜包谷：这家店也好大，面包种类多，还有可爱的小蛋糕，3元一个的昨日面包，捡漏 🧽 海绵客厅：到门口了，没进去，外面看看店铺很文艺，好适合一个人在里面安静待着 🍧 OTTO gelato：八桶，不是常规口味的冰淇淋，可以尝尝再选择购买，虽然口味名字奇怪，但有点好吃的 🎄 沃康Vollkorn Blue ：韩系首尔笑脸面包，在锦绣公园里，空间大，面包品种丰富，圣诞新品颜值口味在线，好好拍📷出片 🍰 AUFAUF：有各式各样的巴斯克 🍚 立文春、立文夏、泉市鲜活牛肉：逛累了，就去吃一顿正餐 🍲 鸟鸟好吃店：吃了，一般，性价比不高 	 走不动了，剩下的半条路下次再去😋 还有很多好吃的店‼️ 	 ☕️ 人生无限公司：有简餐，适合去吃个brunch，下次上午去 🍐 囤囤馒头店：超多花式馒头，将馒头做不同形状，各种口味的馅料，之前在面包集市买过，好吃 🍮 澄沙ann：听说布丁芭菲杯和焦糖布丁好吃，记下来 	 #每天都有值得记录的瞬间[话题]# #今天gelato一个[话题]# #宝藏甜品店分享[话题]# #甜点日常[话题]# #周末去哪儿[话题]# #杭州[话题]# #一口惊艳的gelato[话题]# #条条小马路都好吃[话题]#  #宝藏甜品店分享[话题]# #美食日常[话题]# #杭州周末去哪儿[话题]# #杭州Citywalk[话题]# #杭州探店[话题]# #面包店[话题]# #杭州旅游[话题]# #citywalk[话题]# #100家探店计划[话题]# #攻略[话题]# #打卡[话题]# #COTD咖啡探店[话题]# #城西[话题]# #5号线萍水街[话题]# #杭州拍照[话题]# #旅游[话题]# #生活薯[话题]# #美食薯[话题]# #日常薯[话题]# #浪漫生活的记录者[话题]# #下午茶[话题]#,"每天都有值得记录的瞬间, 今天gelato一个, 宝藏甜品店分享, 甜点日常, 周末去哪儿, 杭州, 一口惊艳的gelato, 条条小马路都好吃, 美食日常, 杭州周末去哪儿, 杭州Citywalk, 杭州探店, 面包店, 杭州旅游, citywalk, 100家探店计划, 攻略, 打卡, COTD咖啡探店, 城西, 5号线萍水街, 杭州拍照, 旅游, 生活薯, 美食薯, 日常薯, 浪漫生活的记录者, 下午茶"
在杭州过年去哪玩🧧解锁不一样的年味儿～,"还有不到十天就春节了，上次给大家分享了大运河附近的年味City walk，这条老底子杭州市井年味的线路也非常值得一走～ 	 🚶‍♀️Citywalk路线： 地铁“吴山广场”站👉河坊街👉大井巷👉鼓楼👉德寿宫👉地铁“江城路”站 ⏰用时：2h 	 🏮河坊街： 如果时间充裕，河坊街值得深入逛一逛，步行街上虽热闹但很多网红店，建议去小巷。 ▫️胡庆余堂中药博物馆（08：30 - 17：00） 全国首家中 药专题博物馆，在这里，我们可以深入了解中华五千年的中 药文化。 ▫️江南铜屋（09：00 - 22：00） 江南铜屋是由朱炳仁父子精心打造的艺术殿堂，整座建筑除墙面地面外全为铜质结构装饰。 	 🏮大井巷： 融合了百年老字号与众多新兴宝藏店铺，承载着老杭州的珍贵记忆，同时又充满了现代活力☕🍵 	 🏮鼓楼： 始建于五代时期的南朝，它静静见证着杭州的千年变迁，是杭州的标志性古建筑之一。 	 🏮鼓楼堂 1885年的基督教堂，1931年改建为中国宫殿式教堂，进到教堂里黄色玻璃让进来的光线全是金黄的圣光。 	 🏮南宋书店 在穿过鼓楼门之前，往左看有一幢灰色的大玻璃窗的建筑，享有“浙江蕞美书店”的美名🏅，青砖黑瓦和现代材质相呼应，是普利兹克建筑奖获得者王澍的建筑作品。 	 🏮德寿宫 杭州人自己的小故宫。其内宫殿与园林并置，宋高宗、吴皇后、宋孝宗、谢皇后等历史名人曾居住于此，见证了南宋的兴衰。从北门出去后, 宫外有一面红墙，大约有一百多米长，每年都会精心布置新年装置。 	 #城市漫步计划[话题]# #杭州旅游[话题]# #chinatravel[话题]# #城市探寻计划[话题]# #中式旅行天花板[话题]# #一眼就心动的中国古建[话题]# #杭州旅游攻略[话题]# #河坊街[话题]# #德寿宫红墙[话题]# #派兔旅行[话题]#","城市漫步计划, 杭州旅游, chinatravel, 城市探寻计划, 中式旅行天花板, 一眼就心动的中国古建, 杭州旅游攻略, 河坊街, 德寿宫红墙, 派兔旅行"
杭州人文citywalk小众路线：直达书店！,也许这条路线杭州本地的朋友已经熟悉了，推荐给更多从外地过来探访书店的朋友吧———虽然小河直街已经有些不堪入目了（比起三年半前书店刚成立时已经面目全非），但是书店附近还是有值得散步观光的地方的。 · 下面是文字版的路线指南，大家也可以在逛完书店后去走走： 运河广场——拱宸桥——桥西历史文化街区——小河公园——再见城市旧书店 · #杭州小河直街[话题]# #杭州京杭大运河[话题]# #拱宸桥[话题]# #小河公园[话题]# #旧书店[话题]# #杭州书店[话题]# #杭州再见城市旧书店[话题]# #杭州city_walk[话题]#,"杭州小河直街, 杭州京杭大运河, 拱宸桥, 小河公园, 旧书店, 杭州书店, 杭州再见城市旧书店, 杭州city_walk"
杭州徒步赏枫天花板！像打翻了秋天的调色盘,分享一条秋日徒步路线 全程大概既可以赏秋看枫叶🍁还可以爬山逛茶园，俯瞰西湖和钱塘江 全场大概7公里，很适合亲子游玩和大学生周末团建哈哈 	 🗺️路线分享 九溪➡️九溪烟树➡️理安寺➡️贵人峰➡️虎跑 	 1⃣️地铁水澄桥B口出，坐公交接驳线到九溪站下车 	 2⃣️九溪烟树 从九溪公交站一路走，随处可见的枫叶，而且一路上能看到茶园溪水。有观光车可以坐，从千禧酒店上车，到九溪烟树，票价8r💰 但是步行看枫叶更美～ 	 3⃣️理安寺 现在没有寺庙，主要是吃饭的地方，但可以免费参观🍵枫叶打卡点：理安寺门口、寺内伏虎禅师雕塑附近 	 4⃣️贵人峰 从理安寺出来，往马儿山方向走，大约爬行1小时可以到达贵人峰。登顶可以俯瞰西湖和钱塘江，旁边还有大片茶山，真的很美～ 	 5⃣️虎跑 一路下山就到了虎跑。进入不需要门票，因为都用体力代替了😂枫叶和建筑相得益彰，记得在茶壶边拍摄枫王 	 ⚠️游玩tips ✅这条路线需要爬山，爬山路程大概1个多小时，记得穿舒适的鞋子 ✅建议自备面包小零食，补充体力🍞 ✅九溪观光车路线：千禧酒店-九龙苑-九溪烟树-杨梅岭村。单站单程5r，两站单程8r，三站单程12r #杭州周末去哪儿[话题]# #杭州citywalk[话题]# #不辜负每个周末[话题]# #九溪[话题]# #虎跑[话题]# #轻松徒步路线[话题]# #又到登山赏红叶的好时节[话题]# #杭州旅游[话题]# #枫叶[话题]#,"杭州周末去哪儿, 杭州citywalk, 不辜负每个周末, 九溪, 虎跑, 轻松徒步路线, 又到登山赏红叶的好时节, 杭州旅游, 枫叶"
28W小孕妇｜杭州周末去哪遛1️⃣,👉睡到自然醒，带上水果小零食和司机出发 	 🚗至三台山路上选个餐厅吃个午饭，车就可以一直免费停餐厅里了，完美解决西湖景区停车难问题（附近停车场基本10元一小时） 	 🤰遛弯主路线：起点三台山路—乌龟潭—浴鹄湾—花港观鱼—返程途径于谦祠—回到起点开车回家（见图1路线） 	 ✅闭环全程大约1W步，280大卡，中间有很多小亭子和椅子可以休息，平路为主，几乎不用爬台阶，走走停停大概2.5-3小时，最主要是本路线人不密集！好天景色也很美，全文原图无滤镜，非常适合孕后期的小姐妹们周末遛弯～#快乐小孕妇的周末日常[话题]# #推荐一个好地方[话题]#,"快乐小孕妇的周末日常, 推荐一个好地方"
杭州秋日zui美徒步路线🍂（附路线图🚶,最近又找到了新的西湖徒步路线，究极森林氧吧，有山有水有意境，拍照也无敌好看！！ 看完这条视频包学会怎么走❗️ . 路线：九溪➡️九溪烟树➡️理安寺➡️杨梅岭➡️上满觉陇➡️下满觉陇➡️汤屋➡️四眼井 . 想要路线图的阔以在视频里截图，或者后台t我~ #杭州[话题]#  #杭州旅游[话题]#  #杭州徒步[话题]#  #杭州西湖旅游[话题]#  #杭州西湖徒步[话题]#  #徒步[话题]#  #徒步路线推荐[话题]#  #杭州徒步路线[话题]#  #九溪[话题]#  #九溪十八涧[话题]#  #九溪烟树[话题]#  #九溪徒步[话题]#  #杨梅岭[话题]#  #杨梅岭村[话题]#  #满觉陇[话题]#  #满觉陇桂花[话题]#  #桂花[话题]#  #满觉陇汤屋[话题]#  #千与千寻汤屋[话题]#  #汤屋[话题]#  #四眼井[话题]#  #下满觉陇[话题]#  #上满觉陇[话题]#  #周末[话题]#  #周末遛娃[话题]#  #秋游记[话题]#  #周末去哪玩[话题]#  #周末快乐碎片[话题]#  #周末徒步[话题]#  #西湖景点[话题]#  #西湖[话题]#  #西湖美景[话题]#   #秋季[话题]#  #citywalk[话题]#  #旅游[话题]#  #旅游攻略[话题]#,"杭州, 杭州旅游, 杭州徒步, 杭州西湖旅游, 杭州西湖徒步, 徒步, 徒步路线推荐, 杭州徒步路线, 九溪, 九溪十八涧, 九溪烟树, 九溪徒步, 杨梅岭, 杨梅岭村, 满觉陇, 满觉陇桂花, 桂花, 满觉陇汤屋, 千与千寻汤屋, 汤屋, 四眼井, 下满觉陇, 上满觉陇, 周末, 周末遛娃, 秋游记, 周末去哪玩, 周末快乐碎片, 周末徒步, 西湖景点, 西湖, 西湖美景, 秋季, citywalk, 旅游, 旅游攻略"
快码住这条杭州植物园citywalk攻略,请大数据推给要来杭州旅游的朋友 杭州植物园有六千多种植被，被称为植物博物馆 开放时间8:30- -16:30门票10元早上八点前或者下午五点之后入园免费 出行:建议直接打车到植物园北门or坐89公交车到浙大玉泉站步行10分钟到植物园北门 路线:植物园北门(人口)→山水园-→玉泉鱼跃→百草园- >韩美林艺术馆-→水生植物区-→植物园青芝坞门(出口) 山水园的睡莲开的满满的岸边也有不少用手机也可以拍的很清楚睡莲的上班时间是早上7:00-下午15:00左右要观赏睡莲的朋友情赶着这个时间段噢它们可是植物界的公务员有下班时间哒 玉泉鱼跃里面的鱼超级超级肥美每条都比我大腿还大! 韩美林艺术馆免预约开放时间:周三一周一9:00-16:30周二闭馆要拍大佛头的朋友周二闭馆日照常开放9:00-18:00 水生植物区有大片大片的草坪走累了坐在路边的椅子上晒晒太阳非常治愈 最后从青芝坞门出去顺路逛逛青芝坞环境非常好的生活区也有餐厅可以用餐 #一起去山林吸氧[话题]# #一个人的旅行[话题]# #旅游攻略[话题]# #杭州[话题]# #徒步[话题]# #徒步路线推荐[话题]# #游玩攻略[话题]# #假日citywalk[话题]# #人文景点分享[话题]# #大自然[话题]# #野餐[话题]#,"一起去山林吸氧, 一个人的旅行, 旅游攻略, 杭州, 徒步, 徒步路线推荐, 游玩攻略, 假日citywalk, 人文景点分享, 大自然, 野餐"
杭州烟火气！🔥老底子年味citywalk！,杭州过年氛围越来越浓了！藏在杭州老市区的这条经典citywalk路线很值得一逛，提前来感受老杭城的烟火气年味，一路还能逛吃逛喝，图片最后附一日游路线图！ 	 🗺️【年味Citywalk路线】：五柳巷➠德寿宫➠大马弄➠城隍牌楼-中山南路➠鼓楼➠大井巷➠河坊街 	 ✔️五柳巷（P2-P6）： 人很少的老居民房小巷子，水上巴士7号线途径地。有一些咖啡店☕️和手作店，已经有了新年布景🏮，在这里走走很安逸舒服🍃。推荐“什么鬼”的舒芙蕾🍮很好吃！ 	 ✔️德寿宫（P7-P8）： 德寿宫北出口的红墙简直是年味当担，阳光☀️洒在红墙上光影斑驳，拍照很出片！📸还有落叶🍁新年装饰，创意十足！入内参观可在gzh免费预约！📅 	 ✔️大马弄（P10）： 杭州烟火气🔥十足的菜市场，有很多地道的美食小吃，临近过年很多店铺门口晒着成片的酱鸭咸鱼，年味气息扑面而来。 🌟美食推荐：釜山小吃、周萍粽子、永康肉麦饼、城隍豆浆、千岛湖豆腐饼、小左金元宝蛋饺、蒋师傅酥鱼、甜酒酿、葱包烩。 	 ✔️城隍牌楼（P9）： 打卡好运来礼品店🎁，超多喜庆年货，红红火火过大年！ 	 ✔️中山南路（P9）： 春风茶馆🍵门口的年味装饰很好看，梧桐大道拍照也很好看，沿途有很多美食店。 🌟美食推荐：三毛烤鸡、泮芳春煎饺、游埠豆浆、孙奶奶葱包烩 	 ✔️鼓楼-大井巷-河坊街（P11-P15）： 游客必去的商业景点，临近过年这里也有很多年味布置很好看。大井巷有很多咖啡店和创意手作店。南宋书房📚建筑空间感很强，晚上门口会有驻唱。 	 #杭州周末去哪儿[话题]# #杭州Citywalk[话题]# #杭州[话题]# #杭州旅游[话题]# #杭州春节[话题]# #杭州年味[话题]# #春节去哪儿[话题]# #大马弄[话题]# #河坊街[话题]# #我的春节这样过[话题]# #杭州拍照[话题]# #捕捉身边的年味[话题]#,"杭州周末去哪儿, 杭州Citywalk, 杭州, 杭州旅游, 杭州春节, 杭州年味, 春节去哪儿, 大马弄, 河坊街, 我的春节这样过, 杭州拍照, 捕捉身边的年味"
