title,desc,tags
04女大穷游杭州citywalk❗（附便宜机票攻略,杭州超全攻略！！ 熬夜吐血整理 这篇专为想要去杭州的姐妹做的！✌🏻 超详细city walk路线 现在这个季节杭州基本上是5℃左右！一定要注意保暖，如果是阴雨天会更冷！！ 立马把便宜订机票的方法告诉姐妹们！！ - 同款低价机票怎么订👇 ① 点击左下角按钮跳转至去哪儿旅行app 领取优惠！ ②看不到左下角按钮的宝子，打开去哪儿旅行app搜【566923】，点击搜索 🔍点击悬浮窗即可领取优惠下单！ - 卷都是全国通用～随时下单～ 🉐20¥机票燃油卷 🉐50¥深航机票卷 🉐30¥出境机票抵扣卷 🉐10¥招行专享卷 🉐全网比价最高可赔付100！ - ﻿#怎么买机票便宜[话题]#﻿ ﻿#杭州旅游[话题]#﻿ ﻿#杭州机票[话题]#﻿ ﻿#杭州机票怎么买便宜[话题]#﻿ ﻿#便宜机票[话题]#﻿ ﻿#便宜机票怎么买[话题]#﻿ ﻿#特价机票[话题]#﻿ ﻿#特价机票攻略[话题]#﻿ ﻿#特价机票怎么买[话题]#﻿ ﻿#特价机票怎么订[话题]#﻿﻿,"怎么买机票便宜, 杭州旅游, 杭州机票, 杭州机票怎么买便宜, 便宜机票, 便宜机票怎么买, 特价机票, 特价机票攻略, 特价机票怎么买, 特价机票怎么订"
杭州Vlog🫧周末市中心宝藏CityWalk路线📍,分享一条周末超适合和闺蜜拍照打卡或者一人慢慢逛的宝藏CityWalk路线🥹 1️⃣拾里步行街 不夸张这是杭州新晋韩风拍照街区！ins满满谁不爱啊！ 2️⃣直绒巷 每一家店都好有自己的风格，随便拍都很出片！ 3️⃣狮虎桥 整条街都是古着店，中古爱好者肯定会被硬控！ 4️⃣武林路 很特别的网红涂鸦墙，武林路附近还有很多好吃好玩的，去D11的三姐妹吃一顿正宗杭帮菜，25年老店盲点不踩雷！ #杭州[话题]# #citywalk[话题]# #城市探寻计划[话题]# #旅行碎碎念[话题]# #笔记灵感[话题]# #周末去哪儿[话题]# #杭州拍照[话题]# #杭州旅行[话题]# #小众旅游地[话题]# #杭州网红打卡地[话题]# #杭州必打卡[话题]# #武林路[话题]# #西湖边的美食餐厅[话题]# #杭三姐妹[话题]# #浪漫生活记录者[话题]# #Tiktok[话题]# #boyfriend[话题]# #American[话题]# #宝宝辅食[话题]# #chinesefood[话题]# #老外[话题]# #refugees[话题]# #喜欢city walk吗？[PK]#,"杭州, citywalk, 城市探寻计划, 旅行碎碎念, 笔记灵感, 周末去哪儿, 杭州拍照, 杭州旅行, 小众旅游地, 杭州网红打卡地, 杭州必打卡, 武林路, 西湖边的美食餐厅, 杭三姐妹, 浪漫生活记录者, Tiktok, boyfriend, American, 宝宝辅食, chinesefood, 老外, refugees"
良渚真是杭州宝藏❗春节citywalk一日游攻略,春节来杭州旅游 比起去西湖、灵隐寺人挤人 我更推荐你去余杭区体验下良渚这条小众又好玩的游玩路线 ✅文化➕历史➕艺术相结合 ✅景点免费，而且大多在室内，冬天也不冷 ✅拍照还嘎嘎出片 . 📝良渚一日游路线： 良渚遗址公园👉杭州国家版本馆👉良渚博物院👉美丽洲教堂👉玉鸟集👉单向空间👉良渚文化艺术中心 ⏰游玩时间：一整天 . 🌟景点攻略： 1️⃣良渚遗址公园 池中粮仓、孤独的树，还有可爱的小鹿，每次来都逛不腻，拍照也巨出片❗ 🎫门票：1月7日到3月31日是免门票的，但要在小🍊序上提前预约噢🤓 ✅游玩顺序：南门-鹿苑-池中粮仓-鸽舍-莫角山站-稚山站-南门出 _ 2️⃣杭州国家版本馆 集博物馆、图书馆、美术馆、展览馆为一体的综合性场馆，好逛又好拍，zui出圈的应属青瓷屏风了 🎫门票：免费，需要在「杭州国家版本馆」小🍊序上预约 _ 3️⃣良渚博物院 良渚证实了中华上下五千年的历史，近期还推出了汉代玉器集萃展 🎫门票：免费，但需要在「良渚古城」小🍊序上提前预约 ✅参观顺序：宜子孙（特展）-1号厅水乡泽国-2号厅文明圣地-3号厅玉魂国魄 _ 4️⃣美丽洲教堂 由日本著名建筑师津岛晓生打造的，建筑线条极简，拍照很好看 _ 5️⃣玉鸟集 文化商业街，有很多文创小店和集市活动，可以在这里吃午饭 6️⃣单向空间 杭州“阿那亚”，很有设计感的一家书店，里面也提供咖啡，冬日暖阳后，坐在超大落地窗前看看书，也很享受～ 7️⃣良渚文化艺术中心 日本建筑大师安藤忠雄设计的作品，工业风的线条和简约的设计，拍照很好看 . ❤️游玩Tips： 1️⃣良渚公园很大，建议可乘坐观光车游玩 2️⃣这次出行路线规划，我参考了「指北旅行」app 🌟选择好想去的景点后，就能智能规划不走回头路的路线，详细到连景点间距离、拍照打卡位都能看到，特别省心❗ 🌟想要get我同款路线的，只要复制小红书链接🔗，到「指北旅行」app粘贴即可获取啦 📣春节有出行计划、又不想费脑做路线攻略的友友们，直接在app内输入你的目的地、出行天数和游玩偏好，就会智能推荐路线啦，超适合懒人✌🏻 #我在家乡当游客[话题]##新年旅行第一站[话题]##打工人的春节staycation[话题]##指北旅行[话题]##旅游攻略[话题]##周末去哪儿[话题]##杭州周边游[话题]##杭州遛娃[话题]##良渚游玩攻略[话题]##冬日旅行收藏夹[话题]#,"我在家乡当游客, 新年旅行第一站, 打工人的春节staycation, 指北旅行, 旅游攻略, 周末去哪儿, 杭州周边游, 杭州遛娃, 良渚游玩攻略, 冬日旅行收藏夹"
杭州不只有西湖灵隐❗还有这些逛不腻的老街,杭州最好逛的[一R][二R]条市井老街， 第三弹： 1⃣：南宋御街 地址：上城区中山中路192号 交通：5号线，江城路站E口出 杭城蕞宋代，南宋遗迹代表！南宋的皇城根就在这里。 十里御街，百年风情！ 美食推荐：蟹粉小笼包 2⃣：河坊街 口碑最受争议 本地人都会说不推荐又推荐的一条街 那么到底值不值得去 我肯定是建议大家去的 分享美食： [一R]：马记宫廷酥牛肉饼 [二R]：龙翔臭豆腐 [三R]：葱包烩 3⃣：大马弄 交通：地铁[五R]号线，候潮门B口下 最有杭州老底子烟火气的一条街 如果想要感受老杭州本土的风土人情 来这逛逛准没错， 大马弄的早市也很好逛 超多美食值得去尝一下： [一R]：蒋师傅酥鱼，[二R]：候大姐葱包烩，[三R]：衢州烤饼[四R]：周萍粽子，等等… 4⃣：五柳巷 交通：地铁[一R]号线，城站D口出 旧时达官贵人居住之处，很有老杭州的市井气息 蕞美水上巴士[七R]号线梅花碑站就在这 美食分享： [一R]：“什么鬼”咖啡店 [二R]：赵宝美点心 TiPS:不算大，10几分钟就能逛完 5⃣：十五奎巷 交通：地铁[五R]号线，江城路E口出 这里是“南宋百老汇”，老街老巷，感受老杭城的人文历史。 附近能看到鼓楼，望仙阁 可以导航到“巴尔干客栈”（图15），这里有网红拍照打卡机位（图15），拍出来非常出片 6⃣：馒头山社区 交通：地铁[五R]号线到候潮门站C口出步行/共享单车 路线：沿着凤凰山脚路，一侧是市井气息满满的老社区，一侧是创意店铺集合地，有很多好拍好吃好逛的买手店，拍照非常出片。 真的太太太喜欢这里的艺术气息了！🍭🍭 #城市中的烟火气[话题]# #杭州[话题]# #河坊街[话题]# #十五奎巷[话题]# #馒头山社区[话题]# #旅行[话题]# #老街[话题]# #杭州老街[话题]# #周末去哪玩[话题]# #国庆[话题]#,"城市中的烟火气, 杭州, 河坊街, 十五奎巷, 馒头山社区, 旅行, 老街, 杭州老街, 周末去哪玩, 国庆"
不早起旅行|杭州新年citywalk路线来咯🎉,今天分享一条不用早起，超适合女生的杭州新年 citywalk 路线。带着我的小闺蜜从孩儿巷出发，经中山北路，抵达杭州中心。娃一路吃一路买，我也逛得起劲，快来看一看吧👇 	 💖 第一站 孩儿巷 📍地铁凤起路A口出来向前，左转就是孩儿巷 1⃣️山东杂粮煎饼（排长队，能加的料多） 2⃣️PainKiller（日咖夜酒，复古蓝色，很有调调） 3⃣Tiger Tea（果茶，暗黑风）️ 4⃣七饼杂货店（毛绒玩具、挂件、包包）️ 5⃣Pasto Cofi Cofi（店面超可爱，咖啡量不多但很香） 6⃣格乐达（面包店，咖啡平价）️ 7⃣J.Y.X ART&Jewelry（女装加饰品，店面可爱）️ 8⃣️橡皮文具店（漂洋过海的文具，价格很美丽） 9⃣️Bud bread慢熟（有点火的面包店，碱水不错） 1⃣️0⃣妙妙蘑古屋（可爱的衣服发饰包包，娃买了个布包238块） 1⃣️1⃣阜阳卷馍（在路的另一边，料很足，麻酱很香） 	 💖 第二站：中山北路 📍孩儿巷走到底左转到中山北路，店分布在马路两侧！ 1⃣️无由（新中式茶馆，很有氛围，奶茶香甜） 2⃣Cheers（可外带鸡尾酒，阿瓦达索命味道清凉）️ 3⃣阿嬷的糖水铺️（复古温暖的新年气氛，甜点糖水都很正宗） 4⃣云山山铜锅米线（牛肉很多，价格不便宜）️ 5⃣AZAHAR Bakery（蛋糕好吃不甜，推荐） 6⃣福福玛（适合学生党的平价女装，包包和围巾也可爱，娃买了两件毛衣400块）️ 7⃣️️吉市Familycafe（好看又好吃，推荐汤咖喱和甜品） 8⃣️苍蝇酒肉馆（日式居酒屋，推荐烧鸟和寿喜锅） 9⃣OUI KITCHEN（网红店，日系风格，舒芙蕾颜值很高，味道不错） 	 💖 第三站：杭州中心 📍中山北路一直走，走到环城北路就是杭州中心，小众店铺+好吃的餐厅大集合！ 1⃣Bco豆库（氛围很好的西餐厅，服务不错，南瓜汤和辣味鲜虾馅饼推荐！） 2️⃣THAI1949西泰料理（打卡多次，娃喜欢黄咖喱牛腩、冷吃鲈鱼，芒果糯米饭） 3️⃣Westwood Cafe西太后（奶茶浓郁，蛋糕颜值很高） 4⃣Azabuya麻布屋（排队王‼️ 冰淇淋可三拼，喜欢巧克力和荔枝） 5⃣校村炸鸡（现点现炸很酥脆，推荐原味，香辣太辣） 6⃣Putoto薯条（土豆脑袋最爱，多种口味，芥末味道有点辣） 	 这条新年CityWalk路线，一点不累，新年气氛很浓，边走边逛边吃，超级适合闺蜜或者一家三口，是一场不早起旅行，赶紧出发吧💕 #不早起旅行日记[话题]# #新年旅行第一站[话题]# #新年版citywalk[话题]# #新年开启我的幸福生活[话题]# #新年吃喝玩乐[话题]# #杭州新年[话题]# #我镜头下的年味儿[话题]#,"不早起旅行日记, 新年旅行第一站, 新年版citywalk, 新年开启我的幸福生活, 杭州新年, 我镜头下的年味儿, 新年吃喝玩乐"
接下来，春节的杭州西湖美到封神！！！,如果你春节来杭州 这几条本地人推荐的游玩路线 一定要码住 	 [一R]经典十景游路线 ↪️苏堤春晓→平湖秋月→柳浪闻莺→花港观鱼→双峰插云→三潭映月→南屏晚钟→雷峰夕照→曲院风荷→断桥残雪 这些景点是西湖最具代表性的风光 特别推荐花港观鱼，去好几个景点都很方便 还能去太子湾、净慈寺、雷峰塔，能坐西湖游船 🧋附近有家1点点奶茶，累了还可点杯热奶茶喝喝 推荐非遗红糖波霸奶茶，三分或者五分甜👍🏻👍🏻 	 [二R]赏梅探幽游路线 灵峰探梅的梅花品种多且密集，可沿着西湖的西线和南线，一览西湖美景和梅花的精致小景 ↪️路线：灵峰探梅→湛碧楼→郭庄→慧因高丽寺→净慈寺→长桥公园（看日落） 	 [三R]佛系祈福游路线 适合喜欢静心祈福的游客，寺庙都非常有名 ↪️路线：北高峰索道→天下第一财神庙→韬光寺→永福寺→灵隐寺→法镜寺→法净寺→法喜寺 建议一早坐索道上山，再步行下山依次打卡各个寺庙 每个寺庙之间步行路程大约10~20分钟 	 [四R]大运河文化游路线 除了西湖，大运河路线也是杭州的必游之地 ↪️路线：拱宸桥→京杭大运河博物馆→桥西历史街区→小河直街→大兜路历史街区→香积寺 桥西历史街区有很多博物馆可以逛，春节期间老街也都装饰一新，晚上灯笼亮起时更是热闹非凡 	 ‼️以上路线各具特色，可以根据个人喜好和时间安排进行选择 	 😋美食 西湖醋鱼：只推荐体验一下就好，毕竟来到来了😂 片儿川：杭式面食，一般人都能接受 	 🚇交通 到西湖核心景区，地铁+公交方便点，自驾停车费很贵 打网约车zui方便，不过高峰期叫车难 	 ❤️游玩小tips 杭州天气较阴冷注意保暖 外穿景区建议自带充电宝 	 #西湖[话题]# #杭州西湖旅游[话题]# #杭州旅游[话题]# #春节旅游[话题]# #杭州[话题]# #江浙沪旅游[话题]# #tiktokrefugee[话题]# #我在家乡当游客[话题]#  #新年旅行第一站[话题]# #在寺庙当一刻钟的佛系青年[话题]# #各地灯会大PK[话题]# #新年版citywalk[话题]# #不早起旅行日记[话题]# #1点点奶茶[话题]# #1点点好喝好喝1点点[话题]# #1点点杭州[话题]# #点门人[话题]#,"西湖, 杭州西湖旅游, 杭州旅游, 春节旅游, 杭州, 江浙沪旅游, tiktokrefugee, 我在家乡当游客, 新年旅行第一站, 在寺庙当一刻钟的佛系青年, 各地灯会大PK, 新年版citywalk, 不早起旅行日记, 1点点奶茶, 1点点好喝好喝1点点, 1点点杭州, 点门人"
不是巴厘岛！是杭州！！！只有0.1%的人去过🍃,"Hi，我叫yy 	 杭州桐庐真是宝藏反向旅游小城！！ 走进这一片绿野仙踪像是到了巴厘岛！！ 保姆级一日游攻略收好~ Tonglu in Hangzhou is truly a treasure town! Entering this green wonderland is like arriving in Bali! Please keep this one-day travel guide~ 	 📍琴溪香谷Qinxi Xianggu 🚗直接导航就能到，门口有停车场 穿过山谷，是一片郁郁葱葱的竹林，萤火虫般星星点点的灯配上竹林的绿色，洗洗眼睛和朋友和家人坐在这里度过一个下午，真的太舒服了~ Walking through the valley, you'll find a lush bamboo forest. The star like lights, which are as twinkling as fireflies, combined with the green of the bamboo forest. Spending an afternoon here with friends or family is really comfortable~ 	 🚶🏻‍♂️游玩路线： 树下茶馆-徒步绿道-状元洞-瀑布咖啡 	 1️⃣瀑布咖啡Waterfall Coffee 二楼的框景拍照好看，坐在绿野仙踪里真的好舒服，当然也可以临河而坐 	 2️⃣状元洞Zhuangyuan Cave 往里面走10分钟便能看到一个天然溶洞，洞内暖和，常年16度，坐在水边好惬意~ 	 3️⃣树下茶馆Tree - Shaded Teahouse 建筑转角好好看，还有新年氛围感！拿着糖葫芦拍照好看！！ 	 桐庐旅行｜桐庐旅游｜桐庐攻略｜桐庐拍照 杭州桐庐｜桐庐游玩｜桐庐路线｜过年旅游 #周末去哪儿[话题]# #来中国就要这样玩[话题]# #我在家乡当游客[话题]# #做一次精神村民[话题]# #新年旅行第一站[话题]# #不早起旅行日记[话题]# #新年版citywalk[话题]#  #反向旅行出门溜溜[话题]# #杭州旅游[话题]# #杭州旅行[话题]# #杭州攻略[话题]# #杭州拍照[话题]# #杭州桐庐[话题]# #桐庐旅行[话题]# #桐庐旅游[话题]# #桐庐攻略[话题]#","周末去哪儿, 来中国就要这样玩, 我在家乡当游客, 做一次精神村民, 新年旅行第一站, 不早起旅行日记, 新年版citywalk, 反向旅行出门溜溜, 杭州旅游, 杭州旅行, 杭州攻略, 杭州拍照, 杭州桐庐, 桐庐旅行, 桐庐旅游, 桐庐攻略"
📍1.22杭州受罪已回。。差点崩溃了。。。,杭州真的是全年无淡季呀，我们挑工作日去的，没想到人也超多…… 确实好玩，但也踩了不少坑，现在就给大家总结一下哈👇 -- ✅杭州游玩路线 ⭕逛买路线： 杭州本地工厂店（逛完再去打卡拍照，不要太出片）→河坊街→太子湾公园→武林夜市 ⭕灵隐寺路线： 北高峰索道上山→灵顺寺→韬光寺→永福寺→灵隐寺→法喜寺 ⭕citywalk路线： 五柳巷→鼓楼→十五奎巷→大马弄→小河直街（体验杭州最原始的街道，有一些文艺感十足的小店，穿着新中式拍照不要太搭） - 🎒杭州怎么穿出片❓ 💥来杭州想要拍照出片，当然还得是新中式啦~ 💥打卡前，真的不要错过杭州这家本地工厂店，聚集了100多个工厂的当季新款 💥衣服很奈斯！件件明码标价，一件也是出厂价，羊绒山羊绒800起，新中式基本6-7百 💥还有专业搭配师帮忙搭配，炒鸡出片的~ 📍地址：杭州市滨江区兴耀大厦1606室（地铁6号线到江汉路站下） - 📍杭州地铁沿线景点 ✔1号线：城隍阁景区、南宋御街、河坊街、京杭大运河 ✔2号线：西湖、良渚文化村 ✔3号线：浙江省博物馆、西溪湿地国家公园、宝石山植物园 ✔4号线：丝绸博物馆、六和文化公园 ✔5号线：京杭大运河博物馆 ✔6号线：云栖小镇、灵山景区、宋城 - 🥘美食建议 👉想吃蟹：去蟹叁寳·蟹黄捞饭（杭州武林店） 👉想吃小吃：玖仟龙游小吃街、武林夜市和大马弄，各式各样的小吃都有 - ❤抵达杭州的交通 ✈机场：杭州萧山国际机场 从这里开车到西湖大概需要1小时左右，🈶机场大巴和地铁，都很方便 🚄火车：杭州站、南站、北站、东站、西站 建议大家买到杭州站，出门没多远就是西湖，交通方便 #杭州旅游[话题]##西湖美景如画[话题]##趁年轻到处走走[话题]##杭州买衣服[话题]##杭州逛街[话题]##真丝新中式[话题]##西湖[话题]##过年穿什么[话题]##2025好运穿搭[话题]#,"杭州旅游, 西湖美景如画, 趁年轻到处走走, 杭州买衣服, 杭州逛街, 真丝新中式, 西湖, 过年穿什么, 2025好运穿搭"
春节来杭州，强推老杭城这条年味citywalk线,春节来杭州除了去西湖 一定不能错过这条老城烟火气十足的年味citywalk 线 行程轻松不累人，地铁直达，好吃好玩好逛 还可以逛逛南宋宫殿 👣详细路线： 江城路地铁站-德寿宫-鼓楼-大马弄（逛吃逛吃）-河坊街-吴山广场地铁站 - 🌟推荐打卡： #德寿宫[话题]# 不去北京也能拍出故宫即视感，北出口的红墙吸引了大批摄影爱好者，穿上汉服旗袍非常出片，尤其阳光洒在红墙上光影斑驳，很有意境，最近新添了很多年味打卡装置，年味十足！这次带娃来参观体验再度升级，博物馆推出AR眼镜导览： ✔️带着眼镜逛博物馆，能够看到额外的信息、动画。同时增强了展品的故事讲述和对背景的理解。全程讲解，能全面生动的了解文物介绍，再也不是走马观花啦！ ✔️时不时还会有传送门，互动性强，跟着导览逛博物馆趣味十足，Bluey 说好神奇，太好玩啦！ ✔️ 在标志性的红墙下，AR生动还原宋高宗、宋孝宗的故事，朝堂议事场景栩栩如生，游客可近距离观赏他们赏花、赏画，还能看到宫女在走廊吹拉弹奏，仿佛穿越回了那个繁华时代。 - #大马弄[话题]# 杭州烟火气🔥十足的菜市场，有很多地道的杭州美食小吃，挂满了酱鸭咸鱼等年货，整条巷子虽不大，是超好逛！每次去都买了超多好吃的 - #鼓楼[话题]# 大牌坊进来，就是南宋御街和大井巷，有很多特色咖啡店和文艺小店，很好逛，南宋书房这里也是一大打卡点，非常有特色的书店 - #河坊街[话题]# 虽然商业气息浓，但是好逛的店还是很多，不仅是一条古老的街道，也是杭州千年商贸文化的缩影，还有很多有趣的博物馆和主题文化展馆！ - #吴山广场[话题]# 老杭人来休闲放松的好地方，景色优美，游玩景点集中，交通方便！也是非常好的遛娃地方，主页有详细的游玩攻略！ 	 #杭州遛娃好去处[话题]#   #杭州新年[话题]#   #杭州年味[话题]#   #杭州拍照[话题]#   #杭州Citywalk[话题]#   #杭州旅游[话题]#  #西湖旅游攻略[话题]#  #不早起旅行日记[话题]#  #新年版citywalk[话题]#  #硬控老外的中式旅行地[话题]#  #西湖[话题]#  #灵隐寺祈福[话题]#  #新年旅行第一站[话题]#  #出发就是最好的计划[话题]#  #反向旅行出门溜溜[话题]#  #藏在小城里的冬天[话题]# #Rokid[话题]##我的育儿关键字[话题]##杭州春节好去处[话题]##新春接福神[话题]##新年旅行第一站[话题]#,"德寿宫, 大马弄, 鼓楼, 河坊街, 吴山广场, 杭州遛娃好去处, 杭州新年, 杭州年味, 杭州拍照, 杭州Citywalk, 杭州旅游, 西湖旅游攻略, 不早起旅行日记, 新年版citywalk, 硬控老外的中式旅行地, 西湖, 灵隐寺祈福, 新年旅行第一站, 出发就是最好的计划, 反向旅行出门溜溜, 藏在小城里的冬天, Rokid, 我的育儿关键字, 杭州春节好去处, 新春接福神"
懒人版‼️杭州老街citywalk南宋御街河坊街,不想走路又想citywalk的姐妹们有福了！ 这条杭州宝藏老街citywalk路线终于是被我找到了，走完下来步数还不到五千步，还有超多店铺等你发掘 建议收藏🌟备用～ - 💼景区没有行李寄存，而且老街都是石板路，行李箱非常难拉 🚗可以到杭州就把行李交给我们，替您送去酒店 也可以最后一天退房时把行李放在酒店，我们替您送去车站机场存好 ⏰全程不用拉行李，比别人多玩6小时 想要试试看的姐妹，dd～ - 👣citywalk路线： 定安路-凤凰寺-南宋御街-河坊街-杭州博物馆-鼓楼-十五奎巷-德寿宫-胡雪岩故居 ⏰全程走路时长不超过1小时，懒人非常友好‼️ 而且一路都是特色小店和本地小吃，适合逛吃逛吃 - 📍凤凰寺：09:00-17:00开放，周五闭馆，中国沿海四大伊斯兰教清真古寺之一 📍南宋御街：南宋都城临安的主要街道，如今是杭州体现南宋城市风貌的重要老街 📍河坊街：杭州“五杭”（杭粉、杭剪、杭扇、杭烟、杭线）出于此地，杭州特色店铺一百余家 📍杭州博物馆：09:00-16:30开放，周二闭馆，镇馆之宝战国水晶杯 📍鼓楼：明代建筑形制，杭州地标建筑之一 📍十五奎巷：感受老杭州的生活气息 📍德寿宫：09:30-17:30开放，宋代极简美学，红墙很出片 📍胡雪岩故居：08:00-17:00开放，门票20，既富有中国传统特色，又具有西方风格 - 使用新镖局行李寄送 😄无需等待： 预约成功后，行李放在酒店前台、寄存点即可离开，无需等待镖师到来 6️⃣多玩6小时： 不用去找地方存行李，返回拿行李，多玩半天 👋空手游玩： 全程不拉行李，爬楼、陡坡、☔️暴雨🌞烈日都无所谓 🙅🏻不计大小重量： 使用寄送，行李箱不计大小、重量，可放心装箱预约 - 需要试试看的姐妹，dd~ - ﻿#南宋御街[话题]#﻿ ﻿#河坊街[话题]#﻿ ﻿#杭州旅游[话题]#﻿ ﻿#行李寄存[话题]#﻿ ﻿#行李寄送[话题]#﻿ ﻿#行李寄送到酒店[话题]#﻿ ﻿#行李寄送攻略[话题]#﻿ ﻿#行李寄送服务[话题]#﻿ ﻿#新镖局[话题]#﻿,"南宋御街, 河坊街, 杭州旅游, 行李寄存, 行李寄送, 行李寄送到酒店, 行李寄送攻略, 行李寄送服务, 新镖局"
